payment_id,rows_count,first_date,last_date,transaction_types,source,is_sale_api,sale_reason,status,status_detail,operation_type,order_id,gross_amount,commission_calc,shipping_calc,launch_net_calc,net_api,extrato_sum,diff_extrato_vs_launch,money_release_date,money_release_status,fetch_error
0008m333pd,1,22-01-2026,22-01-2026,payment,unresolved,False,unresolved_not_found_in_ml,,,,,0.0,0.0,0.0,0.0,0.0,-612.97,0.0,,,non_numeric_reference_id:0008m333pd
136565909343,5,06-01-2026,20-01-2026,mediation | payment | refund | reserve_for_dispute,ml_api_or_cache,True,sale,refunded,bpp_refunded,regular_payment,2000014221168032,37.8,17.04,0.0,20.76,20.76,0.0,-20.76,2026-01-06,released,
136859385813,1,07-01-2026,07-01-2026,payment,ml_api_or_cache,True,sale,approved,accredited,regular_payment,2000014255381574,208.9,25.07,26.94,156.89,156.89,156.89,0.0,2026-01-07,released,
136978696919,1,04-01-2026,04-01-2026,payment,ml_api_or_cache,True,sale,approved,accredited,regular_payment,2000014269845004,274.55,32.95,32.34,209.26,209.26,209.26,0.0,2026-01-04,released,
137002983591,1,10-01-2026,10-01-2026,payment,ml_api_or_cache,True,sale,approved,accredited,regular_payment,2000014272851900,71.15,15.29,0.0,55.86,55.86,55.86,0.0,2026-01-10,released,
137262603377,1,01-01-2026,01-01-2026,payment,ml_api_or_cache,True,sale,approved,accredited,regular_payment,2000014302439842,55.95,13.46,0.0,42.49,42.49,42.49,0.0,2026-01-01,released,
137346866576,1,03-01-2026,03-01-2026,payment,ml_api_or_cache,True,sale,approved,accredited,regular_payment,2000014238898086,71.15,15.29,0.0,55.86,55.86,55.86,0.0,2026-01-03,released,
137369762181,1,06-01-2026,06-01-2026,payment,ml_api_or_cache,True,sale,approved,accredited,regular_payment,2000014316038578,302.0,51.34,28.14,222.52,222.52,222.52,0.0,2026-01-06,released,
137614895655,6,21-01-2026,28-01-2026,mediation | payment | refund | reserve_for_dispute,ml_api_or_cache,True,sale,refunded,bpp_refunded,regular_payment,2000014349388500,369.55,44.35,28.14,297.06,297.06,-75.04,-372.1,2026-01-21,released,
137617703230,3,10-01-2026,10-01-2026,mediation | refund | reserve_for_dispute,ml_api_or_cache,True,sale,refunded,bpp_refunded,regular_payment,2000014270595952,631.65,75.8,28.14,527.71,527.71,-28.14,-555.85,2025-12-26,released,
137641901085,1,06-01-2026,06-01-2026,payment,ml_api_or_cache,True,sale,approved,accredited,regular_payment,2000014352328108,68.3,14.95,0.0,53.35,53.35,53.35,0.0,2026-01-06,released,
137801994937,1,17-01-2026,17-01-2026,payment,ml_api_or_cache,True,sale,approved,accredited,regular_payment,2000014372174448,71.51,15.33,0.0,56.18,56.18,56.18,0.0,2026-01-17,released,
137820920749,1,08-01-2026,08-01-2026,reserve_for_dispute,ml_api_or_cache,True,sale,approved,accredited,regular_payment,2000014374523874,265.9,31.91,24.95,209.04,209.04,209.04,0.0,2025-12-31,released,
137943496999,3,04-01-2026,04-01-2026,mediation | payment | refund,ml_api_or_cache,True,sale,refunded,bpp_refunded,regular_payment,2000014388102882,797.7,95.73,74.85,627.12,627.12,-0.0,-627.12,2026-01-04,released,
137956201281,1,04-01-2026,04-01-2026,payment,ml_api_or_cache,True,sale,approved,accredited,regular_payment,2000014389267090,176.99,21.24,21.1,134.65,134.65,134.65,0.0,2026-01-04,released,
137984713337,1,03-01-2026,03-01-2026,payment,ml_api_or_cache,True,sale,approved,accredited,regular_payment,2000014392230340,266.84,43.15,23.45,200.24,192.95,192.95,-7.29,2026-01-03,released,
138128527733,1,12-01-2026,12-01-2026,payment,ml_api_or_cache,True,sale,approved,accredited,regular_payment,2000014406182452,56.9,13.29,0.0,43.61,43.61,43.61,0.0,2026-01-12,released,
138151129880,3,05-01-2026,05-01-2026,mediation | refund | reserve_for_dispute,ml_api_or_cache,True,sale,refunded,bpp_refunded,regular_payment,2000014335352152,267.8,32.14,25.74,209.92,209.92,-0.0,-209.92,2025-12-26,released,
138157090675,1,01-01-2026,01-01-2026,payment,ml_api_or_cache,True,sale,approved,accredited,regular_payment,2000014409105758,82.64,9.92,12.87,59.85,59.85,59.85,0.0,2026-01-01,released,
138199281600,1,01-01-2026,01-01-2026,payment,ml_api_or_cache,True,sale,approved,accredited,regular_payment,2000014341945804,4656.8,558.82,103.14,3994.84,3994.84,3994.84,0.0,2026-01-01,released,
138209751237,4,08-01-2026,14-01-2026,mediation | refund | reserve_for_dispute,ml_api_or_cache,True,sale,refunded,bpp_refunded,regular_payment,2000014413895652,104.4,12.53,13.96,77.91,77.91,-91.87,-169.78,2025-12-31,released,
138378440869,1,06-01-2026,06-01-2026,payment,ml_api_or_cache,True,sale,approved,accredited,regular_payment,2000014432249208,458.75,55.05,44.45,359.25,359.25,359.25,0.0,2026-01-06,released,
138422010977,1,03-01-2026,03-01-2026,payment,ml_api_or_cache,True,sale,approved,accredited,regular_payment,2000014436712752,138.6,16.63,15.96,106.01,106.01,106.01,0.0,2026-01-03,released,
138438608281,1,20-01-2026,20-01-2026,payment,ml_api_or_cache,True,sale,approved,accredited,regular_payment,2000014438084952,18.9,8.52,0.0,10.38,10.38,10.38,0.0,2026-01-20,released,
138470835041,1,03-01-2026,03-01-2026,payment,ml_api_or_cache,True,sale,approved,accredited,regular_payment,2000014441077294,82.64,9.92,12.87,59.85,59.85,59.85,0.0,2026-01-03,released,
138580747200,1,13-01-2026,13-01-2026,payment,ml_api_or_cache,True,sale,approved,accredited,regular_payment,2000014387859390,52.15,12.75,0.0,39.4,39.4,39.4,0.0,2026-01-13,released,
138589575676,1,08-01-2026,08-01-2026,payment,ml_api_or_cache,True,sale,approved,accredited,regular_payment,2000014388690848,52.15,12.75,0.0,39.4,39.4,39.4,0.0,2026-01-08,released,
138624282840,1,03-01-2026,03-01-2026,payment,ml_api_or_cache,True,sale,approved,accredited,regular_payment,2000014392230340,102.71,0.0,0.0,102.71,100.0,100.0,-2.71,2026-01-03,released,
138651457556,1,01-01-2026,01-01-2026,payment,ml_api_or_cache,True,sale,approved,accredited,regular_payment,2000014395026448,498.65,59.84,24.95,413.86,413.86,413.86,0.0,2026-01-01,released,
138669872419,1,06-01-2026,06-01-2026,payment,ml_api_or_cache,True,sale,approved,accredited,regular_payment,2000014454278950,816.9,98.03,24.95,693.92,693.92,693.92,0.0,2026-01-06,released,
138783129376,1,05-01-2026,05-01-2026,payment,ml_api_or_cache,True,sale,approved,accredited,regular_payment,2000014407676354,457.8,54.94,23.45,379.41,379.41,379.41,0.0,2026-01-05,released,
138801389025,5,12-01-2026,13-01-2026,mediation | payment | refund | reserve_for_bpp_shipping_return,ml_api_or_cache,True,sale,refunded,bpp_refunded,regular_payment,2000014461661668,131.95,22.43,17.96,91.56,91.56,0.0,-91.56,2026-01-12,released,
138829029705,1,13-01-2026,13-01-2026,payment,ml_api_or_cache,True,sale,approved,accredited,regular_payment,2000014465489144,284.9,34.19,23.45,227.26,227.26,227.26,0.0,2026-01-13,released,
138831661975,1,06-01-2026,06-01-2026,payment,ml_api_or_cache,True,sale,approved,accredited,regular_payment,2000014465829754,120.55,13.74,15.96,90.85,84.82,84.82,-6.03,2026-01-06,released,
138832808337,1,05-01-2026,05-01-2026,payment,ml_api_or_cache,True,sale,approved,accredited,regular_payment,2000014465970370,113.9,13.67,13.96,86.27,86.27,86.27,0.0,2026-01-05,released,
138872716908,1,05-01-2026,05-01-2026,payment,ml_api_or_cache,True,sale,approved,accredited,regular_payment,2000014416448380,312.55,37.51,24.95,250.09,250.09,250.09,0.0,2026-01-05,released,
138913692605,1,11-01-2026,11-01-2026,shipping,ml_api_or_cache,False,marketplace_shipment,approved,accredited,regular_payment,46161249818,0.0,0.0,0.0,0.0,0.0,8.99,0.0,2026-01-11,released,
138913716245,1,11-01-2026,11-01-2026,payment,ml_api_or_cache,True,sale,approved,accredited,regular_payment,2000014473265914,126.9,15.23,24.95,86.72,86.72,86.72,0.0,2026-01-11,released,
138913863776,4,02-01-2026,16-01-2026,mediation | refund | reserve_for_dispute,ml_api_or_cache,True,sale,refunded,bpp_refunded,regular_payment,2000014421034758,117.7,14.12,15.01,88.57,88.57,-88.57,-177.14,2025-12-31,released,
138918142027,1,15-01-2026,15-01-2026,payment,ml_api_or_cache,True,sale,approved,accredited,regular_payment,2000014473836012,173.9,20.87,17.95,135.08,135.08,135.08,0.0,2026-01-15,released,
138925781261,1,11-01-2026,11-01-2026,payment,ml_api_or_cache,True,sale,approved,accredited,regular_payment,2000014474729180,545.9,65.51,26.95,453.44,453.44,453.44,0.0,2026-01-11,released,
139007155831,1,11-01-2026,11-01-2026,payment,ml_api_or_cache,True,sale,approved,accredited,regular_payment,2000014482845232,126.9,21.57,17.16,88.17,88.17,88.17,0.0,2026-01-11,released,
139010170535,1,07-01-2026,07-01-2026,payment,ml_api_or_cache,True,sale,approved,accredited,regular_payment,2000014483047120,119.9,14.39,13.96,91.55,91.55,91.55,0.0,2026-01-07,released,
139026984141,1,07-01-2026,07-01-2026,shipping,ml_api_or_cache,False,no_order_id,approved,accredited,money_transfer,,0.0,0.0,0.0,0.0,0.0,10.9,0.0,2026-01-07,released,
139028602698,1,07-01-2026,07-01-2026,payment,ml_api_or_cache,True,sale,approved,accredited,regular_payment,2000014432874558,284.9,34.19,23.45,227.26,227.26,227.26,0.0,2026-01-07,released,
139030048789,1,08-01-2026,08-01-2026,payment,ml_api_or_cache,True,sale,approved,accredited,regular_payment,2000014484760584,119.9,14.39,13.96,91.55,91.55,91.55,0.0,2026-01-08,released,
139039262394,1,16-01-2026,16-01-2026,payment,ml_api_or_cache,True,sale,approved,accredited,regular_payment,2000014433811804,33.15,12.14,0.0,21.01,21.01,21.01,0.0,2026-01-16,released,
139045221744,1,06-01-2026,06-01-2026,payment,ml_api_or_cache,True,sale,approved,accredited,regular_payment,2000014434556606,355.1,42.62,42.21,270.27,270.27,270.27,0.0,2026-01-06,released,
139054224668,1,04-01-2026,04-01-2026,payment,ml_api_or_cache,True,sale,approved,accredited,regular_payment,2000014435529468,322.9,54.89,23.45,244.56,244.56,244.56,0.0,2026-01-04,released,
139099194844,1,10-01-2026,10-01-2026,payment,ml_api_or_cache,True,sale,approved,accredited,regular_payment,2000014439536280,115.8,13.9,13.96,87.94,87.94,87.94,0.0,2026-01-10,released,
139125735193,1,13-01-2026,13-01-2026,payment,ml_api_or_cache,True,sale,approved,accredited,regular_payment,2000014493652994,165.9,19.91,17.95,128.04,128.04,128.04,0.0,2026-01-13,released,
139129400507,1,10-01-2026,10-01-2026,payment,ml_api_or_cache,True,sale,approved,accredited,regular_payment,2000014493982342,117.9,14.15,15.01,88.74,88.74,88.74,0.0,2026-01-10,released,
139159212087,1,10-01-2026,10-01-2026,payment,ml_api_or_cache,True,sale,approved,accredited,regular_payment,2000014497677726,176.9,21.23,17.95,137.72,137.72,137.72,0.0,2026-01-10,released,
139203929962,1,03-01-2026,03-01-2026,payment,ml_api_or_cache,True,sale,approved,accredited,regular_payment,2000014447467240,168.05,20.17,17.95,129.93,129.93,129.93,0.0,2026-01-03,released,
139213716686,1,05-01-2026,05-01-2026,payment,ml_api_or_cache,True,sale,approved,accredited,regular_payment,2000014448218470,94.9,11.39,11.97,71.54,71.54,71.54,0.0,2026-01-05,released,
139255269695,1,10-01-2026,10-01-2026,payment,ml_api_or_cache,True,sale,approved,accredited,payment_addition,2000014488073740,63.9,2.87,0.0,61.03,61.03,61.03,0.0,2026-01-10,released,
139259469329,1,11-01-2026,11-01-2026,payment,ml_api_or_cache,True,sale,approved,accredited,regular_payment,2000014507383438,467.3,56.08,26.95,384.27,384.27,384.27,0.0,2026-01-11,released,
139291861708,1,11-01-2026,11-01-2026,payment,ml_api_or_cache,True,sale,approved,accredited,regular_payment,2000014453328642,52.15,0.0,0.0,52.15,52.15,52.15,0.0,2026-01-11,released,
139313216580,1,06-01-2026,06-01-2026,payment,ml_api_or_cache,True,sale,approved,accredited,regular_payment,2000014454195942,284.9,34.19,23.45,227.26,227.26,227.26,0.0,2026-01-06,released,
139315606888,1,04-01-2026,04-01-2026,payment,ml_api_or_cache,True,sale,approved,accredited,regular_payment,2000014454279344,127.2,21.62,15.96,89.62,89.62,89.62,0.0,2026-01-04,released,
139348906355,5,16-01-2026,19-01-2026,mediation | payment | refund | reserve_for_dispute,ml_api_or_cache,True,sale,refunded,bpp_refunded,regular_payment,2000014515283024,117.7,14.12,15.71,87.87,87.87,0.0,-87.87,2026-01-16,released,
139372712227,1,18-01-2026,18-01-2026,payment,ml_api_or_cache,True,sale,approved,accredited,regular_payment,2000014516733978,20.79,9.78,0.0,11.01,11.01,11.01,0.0,2026-01-18,released,
139374897181,1,17-01-2026,17-01-2026,payment,ml_api_or_cache,True,sale,approved,accredited,regular_payment,2000014516905152,20.79,9.78,0.0,11.01,11.01,11.01,0.0,2026-01-17,released,
139376839014,1,08-01-2026,08-01-2026,payment,ml_api_or_cache,True,sale,approved,accredited,regular_payment,2000014456899946,116.75,14.01,13.96,88.78,88.78,88.78,0.0,2026-01-08,released,
139380061139,2,21-01-2026,21-01-2026,payment | reserve_for_dispute,ml_api_or_cache,True,sale,refunded,bpp_refunded,regular_payment,2000014517215696,276.35,23.41,23.45,229.49,219.49,0.0,-229.49,2026-01-21,released,
139388729817,1,18-01-2026,18-01-2026,payment,ml_api_or_cache,True,sale,approved,accredited,regular_payment,2000014517810802,390.35,66.36,23.45,300.54,300.54,300.54,0.0,2026-01-18,released,
139414147108,1,10-01-2026,10-01-2026,payment,ml_api_or_cache,True,sale,approved,accredited,regular_payment,2000014458793808,246.9,41.97,24.95,179.98,179.98,179.98,0.0,2026-01-10,released,
139418035561,1,17-01-2026,17-01-2026,payment,ml_api_or_cache,True,sale,approved,accredited,regular_payment,2000014520232314,60.7,14.03,0.0,46.67,46.67,46.67,0.0,2026-01-17,released,
139424002237,1,12-01-2026,12-01-2026,payment,ml_api_or_cache,True,sale,approved,accredited,regular_payment,2000014520673906,163.01,14.52,17.95,130.54,130.54,130.54,0.0,2026-01-12,released,
139549946052,1,19-01-2026,19-01-2026,payment,ml_api_or_cache,True,sale,approved,accredited,regular_payment,2000014472159200,647.9,77.75,26.95,543.2,543.2,543.2,0.0,2026-01-19,released,
139556522094,1,19-01-2026,19-01-2026,payment,ml_api_or_cache,True,sale,approved,accredited,regular_payment,2000014472840962,4817.9,578.15,73.45,4166.3,4166.3,4166.3,0.0,2026-01-19,released,
139562683028,3,02-01-2026,02-01-2026,mediation | payment | refund,ml_api_or_cache,True,sale,refunded,bpp_refunded,regular_payment,2000014473594232,109.9,13.19,13.96,82.75,82.75,-13.96,-96.71,2026-01-02,released,
139632176183,1,01-01-2026,01-01-2026,payout,unresolved,False,unresolved_not_found_in_ml,,,,,0.0,0.0,0.0,0.0,0.0,-350.0,0.0,,,"Client error '404 Not Found' for url 'https://api.mercadopago.com/v1/payments/139632176183'
For more information check: https://developer.mozilla.org/en-US/docs/Web/HTTP/Status/404"
139636133731,1,01-01-2026,01-01-2026,payment,ml_api_or_cache,False,no_order_id,approved,accredited,regular_payment,,0.0,0.0,0.0,0.0,0.0,-1120.47,0.0,2026-01-01,released,
139636302479,1,01-01-2026,01-01-2026,payment,ml_api_or_cache,False,no_order_id,approved,accredited,regular_payment,,0.0,0.0,0.0,0.0,0.0,-1172.33,0.0,2026-01-01,released,
139639491640,1,11-01-2026,11-01-2026,payment,ml_api_or_cache,True,sale,approved,accredited,regular_payment,2000014481658980,126.9,21.57,17.16,88.17,88.17,88.17,0.0,2026-01-11,released,
139641326679,1,10-01-2026,10-01-2026,payment,ml_api_or_cache,True,sale,approved,accredited,regular_payment,2000014532921924,260.2,44.23,23.45,192.52,192.52,192.52,0.0,2026-01-10,released,
139641681407,1,14-01-2026,14-01-2026,payment,ml_api_or_cache,True,sale,approved,accredited,regular_payment,2000014533024116,113.9,13.67,13.96,86.27,86.27,86.27,0.0,2026-01-14,released,
139660582477,1,17-01-2026,17-01-2026,payment,ml_api_or_cache,True,sale,approved,accredited,regular_payment,2000014535129302,65.33,15.84,0.0,49.49,49.49,49.49,0.0,2026-01-17,released,
139673707916,1,07-01-2026,07-01-2026,payment,ml_api_or_cache,True,sale,approved,accredited,regular_payment,2000014484410824,34.9,12.43,0.0,22.47,22.47,22.47,0.0,2026-01-07,released,
139712861114,1,10-01-2026,10-01-2026,payment,ml_api_or_cache,True,sale,approved,accredited,regular_payment,2000014488073740,129.9,11.69,0.0,118.21,118.21,118.21,0.0,2026-01-10,released,
139727192699,1,16-01-2026,16-01-2026,payment,ml_api_or_cache,True,sale,approved,accredited,regular_payment,2000014541130792,397.0,47.64,26.95,322.41,322.41,322.41,0.0,2026-01-16,released,
139747405077,1,11-01-2026,11-01-2026,payment,ml_api_or_cache,True,sale,approved,accredited,regular_payment,2000014542957036,128.9,15.47,15.96,97.47,97.47,97.47,0.0,2026-01-11,released,
139748255973,1,11-01-2026,11-01-2026,payment,ml_api_or_cache,True,sale,approved,accredited,regular_payment,2000014543045210,289.0,34.68,24.95,229.37,229.37,229.37,0.0,2026-01-11,released,
139749344683,3,02-01-2026,02-01-2026,mediation | payment | refund,ml_api_or_cache,True,sale,refunded,bpp_refunded,regular_payment,2000014543139992,4850.0,507.0,24.95,4318.05,4318.05,0.0,-4318.05,2026-01-02,released,
139761721655,1,16-01-2026,16-01-2026,payment,ml_api_or_cache,True,sale,approved,accredited,regular_payment,2000014544604090,142.4,17.09,15.96,109.35,109.35,109.35,0.0,2026-01-16,released,
139777127731,1,17-01-2026,17-01-2026,payment,ml_api_or_cache,True,sale,approved,accredited,regular_payment,2000014546387786,583.2,69.98,24.95,488.27,488.27,488.27,0.0,2026-01-17,released,
139809851929,5,22-01-2026,27-01-2026,mediation | payment | refund | reserve_for_dispute,ml_api_or_cache,True,sale,refunded,bpp_refunded,regular_payment,2000014549599084,54.77,13.32,0.0,41.45,41.45,0.0,-41.45,2026-01-22,released,
139828603071,3,17-01-2026,21-01-2026,payment | reserve_for_dispute,ml_api_or_cache,True,sale,approved,accredited,regular_payment,2000014551784462,27.55,9.11,0.0,18.44,18.44,18.44,0.0,2026-01-17,released,
139859417764,1,10-01-2026,10-01-2026,payment,ml_api_or_cache,True,sale,approved,accredited,regular_payment,2000014503324760,519.99,62.4,24.95,432.64,432.64,432.64,0.0,2026-01-10,released,
139859500746,1,10-01-2026,10-01-2026,payment,ml_api_or_cache,True,sale,approved,accredited,regular_payment,2000014503330064,519.99,62.4,24.95,432.64,432.64,432.64,0.0,2026-01-10,released,
139903567974,1,14-01-2026,14-01-2026,payment,ml_api_or_cache,True,sale,approved,accredited,regular_payment,2000014507046522,25.7,8.53,0.0,17.17,17.17,17.17,0.0,2026-01-14,released,
139911202778,1,20-01-2026,20-01-2026,payment,ml_api_or_cache,True,sale,approved,accredited,regular_payment,2000014507818668,645.9,77.51,24.95,543.44,543.44,543.44,0.0,2026-01-20,released,
139930660133,3,23-01-2026,23-01-2026,mediation | payment | refund,ml_api_or_cache,True,sale,refunded,bpp_refunded,regular_payment,2000014561818900,412.74,36.77,23.45,352.52,352.52,-0.0,-352.52,2026-01-23,released,
139954665364,1,18-01-2026,18-01-2026,payment,ml_api_or_cache,True,sale,approved,accredited,regular_payment,2000014511628356,20.79,9.78,0.0,11.01,11.01,11.01,0.0,2026-01-18,released,
139955824830,1,16-01-2026,16-01-2026,payment,ml_api_or_cache,True,sale,approved,accredited,regular_payment,2000014511697228,237.4,28.49,22.45,186.46,186.46,186.46,0.0,2026-01-16,released,
139959098708,1,20-01-2026,20-01-2026,payment,ml_api_or_cache,True,sale,approved,accredited,regular_payment,2000014511960006,82.64,9.92,12.87,59.85,59.85,59.85,0.0,2026-01-20,released,
139966584410,1,14-01-2026,14-01-2026,payment,ml_api_or_cache,True,sale,approved,accredited,regular_payment,2000014512632448,40.9,11.41,0.0,29.49,29.49,29.49,0.0,2026-01-14,released,
139967880194,1,13-01-2026,13-01-2026,payment,ml_api_or_cache,True,sale,approved,accredited,regular_payment,2000014512741644,404.44,36.02,23.45,344.97,344.97,344.97,0.0,2026-01-13,released,
139977496192,1,18-01-2026,18-01-2026,payment,ml_api_or_cache,True,sale,approved,accredited,regular_payment,2000014513954282,303.05,36.37,24.95,241.73,241.73,241.73,0.0,2026-01-18,released,
139994063175,1,26-01-2026,26-01-2026,payment,ml_api_or_cache,True,sale,approved,accredited,regular_payment,2000014569273854,30.3,9.7,0.0,20.6,19.08,19.08,-1.52,2026-01-26,released,
139994104927,1,25-01-2026,25-01-2026,payment,ml_api_or_cache,True,sale,approved,accredited,regular_payment,2000014569325786,41.58,19.56,0.0,22.02,22.02,22.02,0.0,2026-01-25,released,
140012522136,1,11-01-2026,11-01-2026,payment,ml_api_or_cache,True,sale,approved,accredited,regular_payment,2000014516240162,163.01,13.54,17.95,131.52,123.37,123.37,-8.15,2026-01-11,released,
140021184146,1,16-01-2026,16-01-2026,payment,ml_api_or_cache,True,sale,approved,accredited,regular_payment,2000014516779056,977.32,94.49,28.45,854.38,854.38,854.38,0.0,2026-01-16,released,
140043405498,1,15-01-2026,15-01-2026,payment,ml_api_or_cache,True,sale,approved,accredited,regular_payment,2000014518255622,134.44,18.69,17.16,98.59,98.59,98.59,0.0,2026-01-15,released,
140051770645,1,05-01-2026,05-01-2026,payment,ml_api_or_cache,False,no_order_id,approved,accredited,regular_payment,,0.0,0.0,0.0,0.0,0.0,-816.28,0.0,2026-01-05,released,
140062875396,1,15-01-2026,15-01-2026,payment,ml_api_or_cache,True,sale,approved,accredited,regular_payment,2000014519964310,194.34,17.31,17.95,159.08,159.08,159.08,0.0,2026-01-15,released,
140078200469,1,05-01-2026,05-01-2026,payout,unresolved,False,unresolved_not_found_in_ml,,,,,0.0,0.0,0.0,0.0,0.0,-40.0,0.0,,,"Client error '404 Not Found' for url 'https://api.mercadopago.com/v1/payments/140078200469'
For more information check: https://developer.mozilla.org/en-US/docs/Web/HTTP/Status/404"
140087737157,3,05-01-2026,05-01-2026,mediation | payment | refund,ml_api_or_cache,True,sale,refunded,bpp_refunded,regular_payment,2000014579732958,333.86,40.06,23.45,270.35,270.35,0.0,-270.35,2026-01-05,released,
140123943397,1,15-01-2026,15-01-2026,payment,ml_api_or_cache,True,sale,approved,accredited,regular_payment,2000014584180812,145.26,17.43,0.0,127.83,127.83,127.83,0.0,2026-01-15,released,
140129724203,3,14-01-2026,24-01-2026,payment | reserve_for_dispute,ml_api_or_cache,True,sale,approved,accredited,regular_payment,2000014584847468,355.94,42.71,23.45,289.78,289.78,289.78,0.0,2026-01-14,released,
140132250075,3,06-01-2026,06-01-2026,mediation | payment | refund,ml_api_or_cache,True,sale,refunded,bpp_refunded,regular_payment,2000014585097894,832.71,74.38,28.45,729.88,729.88,-0.0,-729.88,2026-01-06,released,
140145789304,1,13-01-2026,13-01-2026,payment,ml_api_or_cache,True,sale,approved,accredited,regular_payment,2000014525803690,284.9,34.19,23.45,227.26,227.26,227.26,0.0,2026-01-13,released,
140150665598,1,16-01-2026,16-01-2026,payment,ml_api_or_cache,True,sale,approved,accredited,regular_payment,2000014526025560,119.7,10.66,15.01,94.03,94.03,94.03,0.0,2026-01-16,released,
140201114989,1,16-01-2026,16-01-2026,payment,ml_api_or_cache,True,sale,approved,accredited,regular_payment,2000014592143424,251.98,42.84,23.45,185.69,185.69,185.69,0.0,2026-01-16,released,
140207271759,1,06-01-2026,06-01-2026,payment,ml_api_or_cache,False,no_order_id,approved,accredited,regular_payment,,0.0,0.0,0.0,0.0,0.0,-709.99,0.0,2026-01-06,released,
140207361853,1,17-01-2026,17-01-2026,payment,ml_api_or_cache,True,sale,approved,accredited,regular_payment,2000014592756736,947.4,113.68,46.9,786.82,786.82,786.82,0.0,2026-01-17,released,
140207380399,1,06-01-2026,06-01-2026,payment,ml_api_or_cache,False,no_order_id,approved,accredited,regular_payment,,0.0,0.0,0.0,0.0,0.0,-321.0,0.0,2026-01-06,released,
140213313351,1,26-01-2026,26-01-2026,payment,ml_api_or_cache,True,sale,approved,accredited,regular_payment,2000014593436422,4509.74,541.17,85.95,3882.62,3882.62,3882.62,0.0,2026-01-26,released,
140219674195,1,17-01-2026,17-01-2026,payment,ml_api_or_cache,True,sale,approved,accredited,regular_payment,2000014594134006,407.21,56.64,23.45,327.12,327.12,327.12,0.0,2026-01-17,released,
140220498161,1,17-01-2026,17-01-2026,payment,ml_api_or_cache,True,sale,approved,accredited,regular_payment,2000014594254380,129.62,15.55,17.16,96.91,96.91,96.91,0.0,2026-01-17,released,
140228706789,3,06-01-2026,06-01-2026,mediation | payment | refund,ml_api_or_cache,True,sale,refunded,bpp_refunded,regular_payment,2000014595113868,57.99,10.44,12.87,34.68,34.68,-0.0,-34.68,2026-01-06,released,
140238915792,1,20-01-2026,20-01-2026,payment,ml_api_or_cache,True,sale,approved,accredited,regular_payment,2000014530146356,59.12,13.84,0.0,45.28,45.28,45.28,0.0,2026-01-20,released,
140240998217,5,20-01-2026,21-01-2026,payment | refund | reserve_for_dispute,ml_api_or_cache,True,sale,refunded,bpp_refunded,regular_payment,2000014596501210,647.88,61.74,44.45,541.69,541.69,272.42,-269.27,2026-01-20,released,
140241282353,6,16-01-2026,27-01-2026,mediation | payment | refund | reserve_for_dispute,ml_api_or_cache,True,sale,refunded,bpp_refunded,regular_payment,2000014596533180,111.4,9.25,13.96,88.19,82.62,-53.86,-142.05,2026-01-16,released,
140245549531,1,17-01-2026,17-01-2026,payment,ml_api_or_cache,True,sale,approved,accredited,regular_payment,2000014597063424,169.46,15.1,20.2,134.16,134.16,134.16,0.0,2026-01-17,released,
140245920492,1,16-01-2026,16-01-2026,payment,ml_api_or_cache,True,sale,approved,accredited,regular_payment,2000014530461008,169.46,23.57,20.2,125.69,125.69,125.69,0.0,2026-01-16,released,
140247993577,1,18-01-2026,18-01-2026,payment,ml_api_or_cache,True,sale,approved,accredited,regular_payment,2000014597387312,397.99,35.45,44.45,318.09,318.09,318.09,0.0,2026-01-18,released,
140249927464,1,20-01-2026,20-01-2026,payment,ml_api_or_cache,True,sale,approved,accredited,regular_payment,2000014530672046,333.35,56.67,24.95,251.73,251.73,251.73,0.0,2026-01-20,released,
140250142885,3,15-01-2026,15-01-2026,mediation | payment | refund,ml_api_or_cache,True,sale,refunded,bpp_refunded,regular_payment,2000014597678312,165.9,19.91,17.95,128.04,128.04,-0.0,-128.04,2026-01-15,released,
140252805392,1,24-01-2026,24-01-2026,payment,ml_api_or_cache,True,sale,approved,accredited,regular_payment,2000014530783566,37.68,9.85,0.0,27.83,27.83,27.83,0.0,2026-01-24,released,
140268488213,1,18-01-2026,18-01-2026,payment,ml_api_or_cache,True,sale,approved,accredited,regular_payment,2000014600061706,109.56,9.76,15.01,84.79,84.79,84.79,0.0,2026-01-18,released,
140282341986,1,17-01-2026,17-01-2026,payment,ml_api_or_cache,True,sale,approved,accredited,regular_payment,2000014532279344,66.3,20.62,0.0,45.68,45.68,45.68,0.0,2026-01-17,released,
140284411096,1,01-01-2026,01-01-2026,payment,ml_api_or_cache,False,no_order_id,approved,accredited,regular_payment,,0.0,0.0,0.0,0.0,0.0,-57.0,0.0,2026-01-01,released,
140291550258,1,01-01-2026,01-01-2026,payout,unresolved,False,unresolved_not_found_in_ml,,,,,0.0,0.0,0.0,0.0,0.0,-1288.44,0.0,,,"Client error '404 Not Found' for url 'https://api.mercadopago.com/v1/payments/140291550258'
For more information check: https://developer.mozilla.org/en-US/docs/Web/HTTP/Status/404"
140297604294,1,11-01-2026,11-01-2026,payment,ml_api_or_cache,True,sale,approved,accredited,regular_payment,2000014533808636,260.2,44.23,23.45,192.52,192.52,192.52,0.0,2026-01-11,released,
140320549982,1,12-01-2026,12-01-2026,payment,ml_api_or_cache,True,sale,approved,accredited,regular_payment,2000014536498356,142.4,17.09,15.96,109.35,109.35,109.35,0.0,2026-01-12,released,
140327697026,1,20-01-2026,20-01-2026,payment,ml_api_or_cache,True,sale,approved,accredited,regular_payment,2000014537278300,30.3,10.14,0.0,20.16,20.16,20.16,0.0,2026-01-20,released,
140335692498,1,20-01-2026,20-01-2026,payment,ml_api_or_cache,True,sale,approved,accredited,regular_payment,2000014538248648,29.39,9.12,0.0,20.27,20.27,20.27,0.0,2026-01-20,released,
140353551251,1,17-01-2026,17-01-2026,payment,ml_api_or_cache,True,sale,approved,accredited,regular_payment,2000014608882418,99.9,11.99,12.87,75.04,75.04,75.04,0.0,2026-01-17,released,
140364018062,1,16-01-2026,16-01-2026,payment,ml_api_or_cache,True,sale,approved,accredited,regular_payment,2000014540221968,464.34,41.36,23.45,399.53,399.53,399.53,0.0,2026-01-16,released,
140365907287,1,15-01-2026,15-01-2026,payment,ml_api_or_cache,True,sale,approved,accredited,regular_payment,2000014610266988,581.5,35.55,0.0,545.95,545.95,545.95,0.0,2026-01-15,released,
140367284397,1,18-01-2026,18-01-2026,payment,ml_api_or_cache,True,sale,approved,accredited,regular_payment,2000014610401062,299.9,35.99,19.95,243.96,243.96,243.96,0.0,2026-01-18,released,
140371246324,1,23-01-2026,23-01-2026,payment,ml_api_or_cache,True,sale,approved,accredited,regular_payment,2000014540757528,138.13,12.31,15.96,109.86,109.86,109.86,0.0,2026-01-23,released,
140374511680,1,15-01-2026,15-01-2026,payment,ml_api_or_cache,True,sale,approved,accredited,regular_payment,2000014541032800,397.99,35.45,44.45,318.09,318.09,318.09,0.0,2026-01-15,released,
140383841782,1,15-01-2026,15-01-2026,payment,ml_api_or_cache,True,sale,approved,accredited,regular_payment,2000014541829940,28.4,9.52,0.0,18.88,18.88,18.88,0.0,2026-01-15,released,
140383841793,1,17-01-2026,17-01-2026,payment,ml_api_or_cache,True,sale,approved,accredited,regular_payment,2000014612140090,269.0,32.28,23.45,213.27,213.27,213.27,0.0,2026-01-17,released,
140395321666,1,25-01-2026,25-01-2026,payment,ml_api_or_cache,True,sale,in_mediation,pending,regular_payment,2000014542862974,1679.88,224.17,85.95,1369.76,1369.76,1369.76,0.0,2026-01-25,released,
140396061192,1,14-01-2026,14-01-2026,payment,ml_api_or_cache,True,sale,approved,accredited,regular_payment,2000014542795676,284.05,34.09,23.45,226.51,226.51,226.51,0.0,2026-01-14,released,
140397652934,1,16-01-2026,16-01-2026,payment,ml_api_or_cache,True,sale,approved,accredited,regular_payment,2000014543088346,169.46,15.1,17.95,136.41,136.41,136.41,0.0,2026-01-16,released,
140405395735,1,18-01-2026,18-01-2026,payment,ml_api_or_cache,True,sale,approved,accredited,regular_payment,2000014614916116,2731.8,327.82,46.9,2357.08,2357.08,2357.08,0.0,2026-01-18,released,
140415090506,3,15-01-2026,20-01-2026,payment | reserve_for_dispute,ml_api_or_cache,True,sale,approved,accredited,regular_payment,2000014545130846,500.0,60.0,19.95,420.05,420.05,420.05,0.0,2026-01-15,released,
140415296210,1,15-01-2026,15-01-2026,payment,ml_api_or_cache,True,sale,approved,accredited,regular_payment,2000014545147914,575.6,97.85,24.95,452.8,452.8,452.8,0.0,2026-01-15,released,
140415539950,3,12-01-2026,17-01-2026,payment | reserve_for_bpp_shipping_return,ml_api_or_cache,True,sale,approved,accredited,regular_payment,2000014545179824,113.9,13.67,13.96,86.27,86.27,86.27,0.0,2026-01-12,released,
140417021109,1,21-01-2026,21-01-2026,payment,ml_api_or_cache,True,sale,approved,accredited,regular_payment,2000014616328800,183.9,22.07,17.95,143.88,143.88,143.88,0.0,2026-01-21,released,
140418369532,1,16-01-2026,16-01-2026,payment,ml_api_or_cache,True,sale,approved,accredited,regular_payment,2000014545536410,404.44,36.02,23.45,344.97,344.97,344.97,0.0,2026-01-16,released,
140422465618,3,02-01-2026,02-01-2026,mediation | payment | refund,ml_api_or_cache,True,sale,refunded,bpp_refunded,regular_payment,2000014545980906,2850.0,507.0,24.95,2318.05,2318.05,0.0,-2318.05,2026-01-02,released,
140422485450,2,02-01-2026,02-01-2026,mediation | payment,ml_api_or_cache,True,sale,refunded,bpp_refunded,regular_payment,2000014545980906,2000.0,0.0,0.0,2000.0,2000.0,0.0,-2000.0,2026-01-02,released,
140423671306,1,17-01-2026,17-01-2026,payment,ml_api_or_cache,True,sale,approved,accredited,regular_payment,2000014546130666,28.4,9.52,0.0,18.88,18.88,18.88,0.0,2026-01-17,released,
140453365536,3,13-01-2026,13-01-2026,mediation | payment | refund,ml_api_or_cache,True,sale,refunded,bpp_refunded,regular_payment,2000014549073068,401.75,48.21,23.45,330.09,330.09,-0.0,-330.09,2026-01-13,released,
140475464202,1,12-01-2026,12-01-2026,payment,ml_api_or_cache,True,sale,approved,accredited,regular_payment,2000014551492682,101.27,10.5,16.41,74.36,74.36,74.36,0.0,2026-01-12,released,
140494466821,3,19-01-2026,19-01-2026,mediation | payment | refund,ml_api_or_cache,True,sale,refunded,bpp_refunded,regular_payment,2000014624077422,387.9,46.55,24.95,316.4,316.4,0.0,-316.4,2026-01-19,released,
140495348777,1,26-01-2026,26-01-2026,payment,ml_api_or_cache,True,sale,approved,accredited,regular_payment,2000014624091440,279.9,32.39,24.95,222.56,212.56,212.56,-10.0,2026-01-26,released,
140496724089,1,08-01-2026,08-01-2026,payment,ml_api_or_cache,False,no_order_id,approved,accredited,regular_payment,,0.0,0.0,0.0,0.0,0.0,-169.03,0.0,2026-01-10,released,
140500440771,3,12-01-2026,12-01-2026,mediation | payment | refund,ml_api_or_cache,True,sale,refunded,bpp_refunded,regular_payment,2000014624651548,134.9,16.19,15.96,102.75,102.75,-0.0,-102.75,2026-01-12,released,
140507536799,3,17-01-2026,17-01-2026,mediation | payment | refund,ml_api_or_cache,True,sale,refunded,bpp_refunded,regular_payment,2000014625438404,259.0,31.08,24.95,202.97,202.97,-0.0,-202.97,2026-01-17,released,
140508355800,1,21-01-2026,21-01-2026,payment,ml_api_or_cache,True,sale,approved,accredited,regular_payment,2000014554951444,69.02,12.9,0.0,56.12,56.12,56.12,0.0,2026-01-21,released,
140515340698,1,13-01-2026,13-01-2026,payment,ml_api_or_cache,True,sale,approved,accredited,regular_payment,2000014555499972,284.05,34.09,23.45,226.51,226.51,226.51,0.0,2026-01-13,released,
140541328108,1,20-01-2026,20-01-2026,payment,ml_api_or_cache,True,sale,approved,accredited,regular_payment,2000014558225620,149.19,20.75,17.96,110.48,110.48,110.48,0.0,2026-01-20,released,
140545137977,5,23-01-2026,27-01-2026,mediation | payment | refund | reserve_for_bpp_shipping_return,ml_api_or_cache,True,sale,refunded,bpp_refunded,regular_payment,2000014629762384,513.03,53.63,24.95,434.45,434.45,0.0,-434.45,2026-01-23,released,
140545194728,1,17-01-2026,17-01-2026,payment,ml_api_or_cache,True,sale,approved,accredited,regular_payment,2000014558656314,147.15,17.66,17.16,112.33,112.33,112.33,0.0,2026-01-17,released,
140546410145,1,24-01-2026,24-01-2026,payment,ml_api_or_cache,True,sale,approved,accredited,regular_payment,2000014629912164,402.9,48.35,23.45,331.1,331.1,331.1,0.0,2026-01-24,released,
140563976561,2,20-01-2026,27-01-2026,payment | reserve_for_dispute,ml_api_or_cache,True,sale,refunded,bpp_refunded,regular_payment,2000014631961236,1338.9,160.67,44.45,1133.78,1133.78,0.0,-1133.78,2026-01-20,released,
140564989669,1,20-01-2026,20-01-2026,payment,ml_api_or_cache,True,sale,approved,accredited,regular_payment,2000014632124272,162.33,15.7,20.2,126.43,126.43,126.43,0.0,2026-01-20,released,
140606200921,1,19-01-2026,19-01-2026,payment,ml_api_or_cache,True,sale,approved,accredited,regular_payment,2000014636456130,208.9,25.07,65.95,117.88,117.88,117.88,0.0,2026-01-19,released,
140623140222,1,26-01-2026,26-01-2026,payment,ml_api_or_cache,True,sale,approved,accredited,regular_payment,2000014566519984,110.1,13.21,15.01,81.88,81.88,81.88,0.0,2026-01-26,released,
140627650994,1,13-01-2026,13-01-2026,payment,ml_api_or_cache,True,sale,approved,accredited,regular_payment,2000014567052138,284.9,34.19,23.45,227.26,227.26,227.26,0.0,2026-01-13,released,
140639185016,1,24-01-2026,24-01-2026,payment,ml_api_or_cache,True,sale,approved,accredited,regular_payment,2000014568605954,284.9,34.19,23.45,227.26,227.26,227.26,0.0,2026-01-24,released,
140640665103,1,21-01-2026,21-01-2026,payment,ml_api_or_cache,True,sale,approved,accredited,regular_payment,2000014639422156,486.9,58.43,93.44,335.03,335.03,335.03,0.0,2026-01-21,released,
140643602789,1,18-01-2026,18-01-2026,payment,ml_api_or_cache,True,sale,approved,accredited,regular_payment,2000014639692040,149.9,17.99,17.16,114.75,114.75,114.75,0.0,2026-01-18,released,
140653454200,1,18-01-2026,18-01-2026,payment,ml_api_or_cache,True,sale,approved,accredited,regular_payment,2000014570691580,366.6,42.79,23.45,300.36,290.36,290.36,-10.0,2026-01-18,released,
140655181652,1,04-01-2026,04-01-2026,payout,unresolved,False,unresolved_not_found_in_ml,,,,,0.0,0.0,0.0,0.0,0.0,-1000.0,0.0,,,"Client error '404 Not Found' for url 'https://api.mercadopago.com/v1/payments/140655181652'
For more information check: https://developer.mozilla.org/en-US/docs/Web/HTTP/Status/404"
140658943809,1,23-01-2026,23-01-2026,payment,ml_api_or_cache,True,sale,approved,accredited,regular_payment,2000014641240064,376.9,45.23,24.95,306.72,306.72,306.72,0.0,2026-01-23,released,
140663847777,1,26-01-2026,26-01-2026,payment,ml_api_or_cache,True,sale,approved,accredited,regular_payment,2000014641668576,10552.9,1266.35,98.95,9187.6,9187.6,9187.6,0.0,2026-01-26,released,
140668502871,1,23-01-2026,23-01-2026,payment,ml_api_or_cache,True,sale,in_mediation,pending,regular_payment,2000014642154928,427.9,51.35,26.95,349.6,349.6,349.6,0.0,2026-01-23,released,
140679906945,1,23-01-2026,23-01-2026,payment,ml_api_or_cache,True,sale,approved,accredited,regular_payment,2000014643143384,289.0,34.68,23.45,230.87,230.87,230.87,0.0,2026-01-23,released,
140684975045,1,23-01-2026,23-01-2026,payment,ml_api_or_cache,True,sale,approved,accredited,regular_payment,2000014643830112,24.9,9.24,0.0,15.66,15.66,15.66,0.0,2026-01-23,released,
140685183415,1,21-01-2026,21-01-2026,payment,ml_api_or_cache,True,sale,approved,accredited,regular_payment,2000014643849184,176.9,21.23,21.1,134.57,134.57,134.57,0.0,2026-01-21,released,
140686543155,1,09-01-2026,09-01-2026,payout,unresolved,False,unresolved_not_found_in_ml,,,,,0.0,0.0,0.0,0.0,0.0,-200.0,0.0,,,"Client error '404 Not Found' for url 'https://api.mercadopago.com/v1/payments/140686543155'
For more information check: https://developer.mozilla.org/en-US/docs/Web/HTTP/Status/404"
140688038213,2,24-01-2026,24-01-2026,payment | refund,ml_api_or_cache,True,sale,refunded,by_admin,regular_payment,2000014644165880,355.94,42.71,0.0,313.23,313.23,0.0,-313.23,2026-01-24,released,
140701705736,1,05-01-2026,05-01-2026,payment,ml_api_or_cache,False,no_order_id,approved,accredited,regular_payment,,0.0,0.0,0.0,0.0,0.0,-757.87,0.0,2026-01-05,released,
140704222179,1,23-01-2026,23-01-2026,payment,ml_api_or_cache,True,sale,approved,accredited,regular_payment,2000014645302206,134.9,16.19,17.16,101.55,101.55,101.55,0.0,2026-01-23,released,
140704272795,1,09-01-2026,09-01-2026,payment,ml_api_or_cache,False,no_order_id,approved,accredited,regular_payment,,0.0,0.0,0.0,0.0,0.0,-119.9,0.0,2026-01-09,released,
140705030609,1,09-01-2026,09-01-2026,payout,unresolved,False,unresolved_not_found_in_ml,,,,,0.0,0.0,0.0,0.0,0.0,-31.9,0.0,,,"Client error '404 Not Found' for url 'https://api.mercadopago.com/v1/payments/140705030609'
For more information check: https://developer.mozilla.org/en-US/docs/Web/HTTP/Status/404"
140706400795,1,27-01-2026,27-01-2026,payment,ml_api_or_cache,True,sale,approved,accredited,regular_payment,2000014645494958,123.9,21.06,0.0,102.84,102.84,102.84,0.0,2026-01-27,released,
140706688211,1,27-01-2026,27-01-2026,shipping,ml_api_or_cache,False,no_order_id,approved,accredited,money_transfer,,0.0,0.0,0.0,0.0,0.0,1.09,0.0,2026-01-27,released,
140713837336,1,18-01-2026,18-01-2026,payment,ml_api_or_cache,True,sale,approved,accredited,regular_payment,2000014577119730,1242.94,120.17,24.95,1097.82,1097.82,1097.82,0.0,2026-01-18,released,
140727267196,1,14-01-2026,14-01-2026,payment,ml_api_or_cache,True,sale,approved,accredited,regular_payment,2000014578554004,251.98,42.84,23.45,185.69,185.69,185.69,0.0,2026-01-14,released,
140758087794,1,16-01-2026,16-01-2026,payment,ml_api_or_cache,True,sale,approved,accredited,regular_payment,2000014581966186,119.5,20.32,13.96,85.22,85.22,85.22,0.0,2026-01-16,released,
140766948216,1,16-01-2026,16-01-2026,payment,ml_api_or_cache,True,sale,approved,accredited,regular_payment,2000014583140532,91.9,11.03,12.87,68.0,68.0,68.0,0.0,2026-01-16,released,
140770707157,5,16-01-2026,16-01-2026,mediation | payment | refund | reserve_for_dispute,ml_api_or_cache,True,sale,refunded,bpp_refunded,regular_payment,2000014651493178,28.7,9.55,0.0,19.15,19.15,0.0,-19.15,2026-01-16,released,
140775069472,1,15-01-2026,15-01-2026,shipping,ml_api_or_cache,False,no_order_id,approved,accredited,money_transfer,,0.0,0.0,0.0,0.0,0.0,1.09,0.0,2026-01-15,released,
140778735616,6,17-01-2026,24-01-2026,mediation | payment | refund | reserve_for_dispute,ml_api_or_cache,True,sale,refunded,bpp_refunded,regular_payment,2000014584648640,209.66,35.64,22.45,151.57,151.57,-67.35,-218.92,2026-01-17,released,
140779626787,1,10-01-2026,10-01-2026,payout,unresolved,False,unresolved_not_found_in_ml,,,,,0.0,0.0,0.0,0.0,0.0,-70.0,0.0,,,"Client error '404 Not Found' for url 'https://api.mercadopago.com/v1/payments/140779626787'
For more information check: https://developer.mozilla.org/en-US/docs/Web/HTTP/Status/404"
140794107861,3,10-01-2026,10-01-2026,mediation | payment | refund,ml_api_or_cache,True,sale,refunded,bpp_refunded,regular_payment,2000014653828072,149.1,25.35,15.96,107.79,107.79,0.0,-107.79,2026-01-10,released,
140797336762,1,17-01-2026,17-01-2026,payment,ml_api_or_cache,True,sale,charged_back,reimbursed,regular_payment,2000014586549554,113.06,13.57,16.41,83.08,83.08,83.08,0.0,2026-01-17,released,
140798451364,1,14-01-2026,14-01-2026,payment,ml_api_or_cache,True,sale,approved,accredited,regular_payment,2000014586655484,116.93,13.04,13.96,89.93,89.93,89.93,0.0,2026-01-14,released,
140806214821,1,22-01-2026,22-01-2026,payment,ml_api_or_cache,True,sale,refunded,bpp_refunded,regular_payment,2000014654836820,124.9,14.99,15.96,93.95,93.95,93.95,0.0,2026-01-22,released,
140831797129,1,24-01-2026,24-01-2026,payment,ml_api_or_cache,True,sale,approved,accredited,regular_payment,2000014657158358,557.89,53.95,23.45,480.49,480.49,480.49,0.0,2026-01-24,released,
140841104797,1,22-01-2026,22-01-2026,payment,ml_api_or_cache,True,sale,approved,accredited,regular_payment,2000014658078910,63.9,14.42,0.0,49.48,49.48,49.48,0.0,2026-01-22,released,
140843722249,1,22-01-2026,22-01-2026,shipping,ml_api_or_cache,False,marketplace_shipment,approved,accredited,regular_payment,46244420828,0.0,0.0,0.0,0.0,0.0,9.99,0.0,2026-01-22,released,
140850000172,1,21-01-2026,21-01-2026,payment,ml_api_or_cache,True,sale,approved,accredited,regular_payment,2000014592014790,1589.66,190.76,44.45,1354.45,1354.45,1354.45,0.0,2026-01-21,released,
140851500510,1,17-01-2026,17-01-2026,payment,ml_api_or_cache,True,sale,approved,accredited,regular_payment,2000014592095014,27.55,9.11,0.0,18.44,18.44,18.44,0.0,2026-01-17,released,
140856831026,1,18-01-2026,18-01-2026,payment,ml_api_or_cache,True,sale,approved,accredited,regular_payment,2000014592580888,275.9,33.11,23.45,219.34,219.34,219.34,0.0,2026-01-18,released,
140860875070,1,16-01-2026,16-01-2026,payment,ml_api_or_cache,True,sale,approved,accredited,regular_payment,2000014592963966,122.26,20.78,18.76,82.72,82.72,82.72,0.0,2026-01-16,released,
140875773384,1,26-01-2026,26-01-2026,payment,ml_api_or_cache,True,sale,approved,accredited,regular_payment,2000014594668662,91.08,10.93,11.97,68.18,68.18,68.18,0.0,2026-01-26,released,
140878309513,1,10-01-2026,10-01-2026,payout,unresolved,False,unresolved_not_found_in_ml,,,,,0.0,0.0,0.0,0.0,0.0,-4000.0,0.0,,,"Client error '404 Not Found' for url 'https://api.mercadopago.com/v1/payments/140878309513'
For more information check: https://developer.mozilla.org/en-US/docs/Web/HTTP/Status/404"
140880408350,2,06-01-2026,06-01-2026,mediation | payment,ml_api_or_cache,True,sale,refunded,bpp_refunded,regular_payment,2000014595113868,29.0,0.0,0.0,29.0,29.0,0.0,-29.0,2026-01-06,released,
140880670580,1,17-01-2026,17-01-2026,payment,ml_api_or_cache,True,sale,approved,accredited,regular_payment,2000014595153584,257.92,22.97,23.45,211.5,211.5,211.5,0.0,2026-01-17,released,
140882564764,1,18-01-2026,18-01-2026,payment,ml_api_or_cache,True,sale,approved,accredited,regular_payment,2000014595305168,57.99,10.44,12.87,34.68,34.68,34.68,0.0,2026-01-18,released,
140882604552,1,18-01-2026,18-01-2026,payment,ml_api_or_cache,True,sale,approved,accredited,regular_payment,2000014595305168,29.0,0.0,0.0,29.0,29.0,29.0,0.0,2026-01-18,released,
140893578070,1,26-01-2026,26-01-2026,payment,ml_api_or_cache,True,sale,approved,accredited,regular_payment,2000014596650250,19.9,8.64,0.0,11.26,11.26,11.26,0.0,2026-01-26,released,
140898783536,5,17-01-2026,24-01-2026,mediation | payment | refund | reserve_for_dispute,ml_api_or_cache,True,sale,refunded,bpp_refunded,regular_payment,2000014597265704,317.9,54.04,23.45,240.41,240.41,0.0,-240.41,2026-01-17,released,
140902184304,1,16-01-2026,16-01-2026,payment,ml_api_or_cache,True,sale,approved,accredited,regular_payment,2000014597699072,319.0,38.28,24.95,255.77,255.77,255.77,0.0,2026-01-16,released,
140905145024,1,17-01-2026,17-01-2026,payment,ml_api_or_cache,True,sale,approved,accredited,regular_payment,2000014598148054,637.18,61.6,28.45,547.13,547.13,547.13,0.0,2026-01-17,released,
140915607218,3,12-01-2026,12-01-2026,mediation | payment | refund,ml_api_or_cache,True,sale,refunded,bpp_refunded,regular_payment,2000014599496942,111.6,38.4,0.0,73.2,73.2,0.0,-73.2,2026-01-12,released,
140918245036,1,06-01-2026,06-01-2026,payout,unresolved,False,unresolved_not_found_in_ml,,,,,0.0,0.0,0.0,0.0,0.0,-100.0,0.0,,,"Client error '404 Not Found' for url 'https://api.mercadopago.com/v1/payments/140918245036'
For more information check: https://developer.mozilla.org/en-US/docs/Web/HTTP/Status/404"
140961637762,1,06-01-2026,06-01-2026,payment,ml_api_or_cache,False,no_order_id,approved,accredited,regular_payment,,0.0,0.0,0.0,0.0,0.0,-518.98,0.0,2026-01-06,released,
140963965997,1,22-01-2026,22-01-2026,payment,ml_api_or_cache,True,sale,approved,accredited,regular_payment,2000014670165664,339.9,57.78,23.45,258.67,258.67,258.67,0.0,2026-01-22,released,
140975114783,1,25-01-2026,25-01-2026,payment,ml_api_or_cache,True,sale,approved,accredited,regular_payment,2000014671532382,174.9,20.99,21.1,132.81,132.81,132.81,0.0,2026-01-25,released,
140979207659,1,26-01-2026,26-01-2026,payment,ml_api_or_cache,True,sale,approved,accredited,regular_payment,2000014671988926,78.9,20.16,0.0,58.74,58.74,58.74,0.0,2026-01-26,released,
140982557100,1,15-01-2026,15-01-2026,payment,ml_api_or_cache,True,sale,approved,accredited,regular_payment,2000014607225674,289.0,34.68,24.95,229.37,229.37,229.37,0.0,2026-01-15,released,
141009085184,3,07-01-2026,07-01-2026,mediation | payment | refund,ml_api_or_cache,True,sale,refunded,bpp_refunded,regular_payment,2000014609240668,521.7,62.61,53.86,405.23,405.23,0.0,-405.23,2026-01-07,released,
141025140799,1,21-01-2026,21-01-2026,payment,ml_api_or_cache,True,sale,approved,accredited,regular_payment,2000014676216998,126.9,15.23,15.96,95.71,95.71,95.71,0.0,2026-01-21,released,
141033243857,1,22-01-2026,22-01-2026,payment,ml_api_or_cache,True,sale,approved,accredited,regular_payment,2000014677027490,299.0,35.88,23.45,239.67,239.67,239.67,0.0,2026-01-22,released,
141043812466,1,26-01-2026,26-01-2026,payment,ml_api_or_cache,True,sale,approved,accredited,regular_payment,2000014612897460,909.9,109.19,65.95,734.76,734.76,734.76,0.0,2026-01-26,released,
141052846576,1,20-01-2026,20-01-2026,payment,ml_api_or_cache,True,sale,approved,accredited,regular_payment,2000014614113640,134.9,16.19,15.96,102.75,102.75,102.75,0.0,2026-01-20,released,
141082834438,1,16-01-2026,16-01-2026,payment,ml_api_or_cache,True,sale,approved,accredited,regular_payment,2000014617486026,99.0,16.83,11.97,70.2,70.2,70.2,0.0,2026-01-16,released,
141085645218,1,17-01-2026,17-01-2026,payment,ml_api_or_cache,True,sale,refunded,bpp_refunded,regular_payment,2000014617713360,128.9,15.47,15.96,97.47,97.47,97.47,0.0,2026-01-17,released,
141089464163,1,23-01-2026,23-01-2026,payment,ml_api_or_cache,True,sale,approved,accredited,regular_payment,2000014683605430,756.9,128.67,44.45,583.78,583.78,583.78,0.0,2026-01-23,released,
141095814009,3,16-01-2026,16-01-2026,mediation | payment | refund,ml_api_or_cache,True,sale,refunded,bpp_refunded,regular_payment,2000014684334406,148.9,17.87,15.96,115.07,115.07,-0.0,-115.07,2026-01-16,released,
141104103063,1,22-01-2026,22-01-2026,payment,ml_api_or_cache,True,sale,approved,accredited,regular_payment,2000014685205602,110.3,13.24,13.96,83.1,83.1,83.1,0.0,2026-01-22,released,
141129363733,1,26-01-2026,26-01-2026,payment,ml_api_or_cache,True,sale,approved,accredited,regular_payment,2000014687984228,44.9,14.13,0.0,30.77,30.77,30.77,0.0,2026-01-26,released,
141146348122,1,18-01-2026,18-01-2026,payment,ml_api_or_cache,True,sale,approved,accredited,regular_payment,2000014623773312,170.9,20.51,20.2,130.19,130.19,130.19,0.0,2026-01-18,released,
141164146806,1,18-01-2026,18-01-2026,payment,ml_api_or_cache,True,sale,approved,accredited,regular_payment,2000014625616444,121.9,14.63,15.96,91.31,91.31,91.31,0.0,2026-01-18,released,
141169888245,1,23-01-2026,23-01-2026,payment,ml_api_or_cache,True,sale,approved,accredited,regular_payment,2000014691990608,42.9,11.65,0.0,31.25,31.25,31.25,0.0,2026-01-23,released,
141173504422,1,20-01-2026,20-01-2026,payment,ml_api_or_cache,True,sale,approved,accredited,regular_payment,2000014626592310,117.9,14.15,15.01,88.74,88.74,88.74,0.0,2026-01-20,released,
141178618265,1,23-01-2026,23-01-2026,payment,ml_api_or_cache,True,sale,approved,accredited,regular_payment,2000014692998148,86.99,10.44,12.87,63.68,63.68,63.68,0.0,2026-01-23,released,
141183074293,1,26-01-2026,26-01-2026,payment,ml_api_or_cache,True,sale,approved,accredited,regular_payment,2000014693505834,994.15,103.93,28.45,861.77,861.77,861.77,0.0,2026-01-26,released,
141185566812,1,25-01-2026,25-01-2026,payment,ml_api_or_cache,True,sale,approved,accredited,regular_payment,2000014627870684,427.9,51.35,26.95,349.6,349.6,349.6,0.0,2026-01-25,released,
141185857315,1,25-01-2026,25-01-2026,payment,ml_api_or_cache,True,sale,approved,accredited,regular_payment,2000014693844510,275.9,33.11,23.45,219.34,219.34,219.34,0.0,2026-01-25,released,
141191916284,1,20-01-2026,20-01-2026,payment,ml_api_or_cache,True,sale,approved,accredited,regular_payment,2000014628567282,349.0,41.88,24.95,282.17,282.17,282.17,0.0,2026-01-20,released,
141192147184,1,20-01-2026,20-01-2026,payment,ml_api_or_cache,True,sale,approved,accredited,regular_payment,2000014628619294,72.9,15.5,0.0,57.4,57.4,57.4,0.0,2026-01-20,released,
141199352377,1,23-01-2026,23-01-2026,payment,ml_api_or_cache,True,sale,approved,accredited,regular_payment,2000014695309564,384.26,35.79,23.45,325.02,325.02,325.02,0.0,2026-01-23,released,
141199931294,3,08-01-2026,08-01-2026,mediation | payment | refund,ml_api_or_cache,True,sale,refunded,bpp_refunded,regular_payment,2000014629622110,500.9,60.11,23.45,417.34,417.34,0.0,-417.34,2026-01-08,released,
141200311283,1,23-01-2026,23-01-2026,payment,ml_api_or_cache,True,sale,approved,accredited,regular_payment,2000014695397594,133.9,16.07,17.16,100.67,100.67,100.67,0.0,2026-01-23,released,
141202009288,1,18-01-2026,18-01-2026,payment,ml_api_or_cache,True,sale,approved,accredited,regular_payment,2000014629799582,118.9,14.27,15.01,89.62,89.62,89.62,0.0,2026-01-18,released,
141203886523,1,23-01-2026,23-01-2026,payment,ml_api_or_cache,True,sale,approved,accredited,regular_payment,2000014695852318,251.98,42.84,23.45,185.69,185.69,185.69,0.0,2026-01-23,released,
141214983508,1,26-01-2026,26-01-2026,payment,ml_api_or_cache,True,sale,approved,accredited,regular_payment,2000014631499978,99.9,11.99,12.87,75.04,75.04,75.04,0.0,2026-01-26,released,
141215405790,1,08-01-2026,08-01-2026,payment,ml_api_or_cache,False,no_order_id,approved,accredited,regular_payment,,0.0,0.0,0.0,0.0,0.0,-569.25,0.0,2026-01-10,released,
141217685720,1,20-01-2026,20-01-2026,payment,ml_api_or_cache,True,sale,approved,accredited,regular_payment,2000014631723116,329.9,39.59,19.95,270.36,270.36,270.36,0.0,2026-01-20,released,
141218053725,3,20-01-2026,20-01-2026,mediation | payment | refund,ml_api_or_cache,True,sale,refunded,bpp_refunded,regular_payment,2000014697651114,259.0,31.08,24.95,202.97,202.97,0.0,-202.97,2026-01-20,released,
141223348545,3,21-01-2026,21-01-2026,mediation | payment | refund,ml_api_or_cache,True,sale,refunded,bpp_refunded,regular_payment,2000014698389602,854.9,145.33,44.45,665.12,665.12,0.0,-665.12,2026-01-21,released,
141234408691,1,26-01-2026,26-01-2026,payment,ml_api_or_cache,True,sale,approved,accredited,regular_payment,2000014699828412,86.99,10.44,12.87,63.68,63.68,63.68,0.0,2026-01-26,released,
141241836725,1,24-01-2026,24-01-2026,payment,ml_api_or_cache,True,sale,approved,accredited,regular_payment,2000014700604830,977.32,94.49,26.95,855.88,855.88,855.88,0.0,2026-01-24,released,
141251658525,1,26-01-2026,26-01-2026,payment,ml_api_or_cache,True,sale,approved,accredited,regular_payment,2000014701595582,86.99,10.44,12.87,63.68,63.68,63.68,0.0,2026-01-26,released,
141252406983,1,23-01-2026,23-01-2026,payment,ml_api_or_cache,True,sale,approved,accredited,regular_payment,2000014701696534,507.9,60.95,26.95,420.0,420.0,420.0,0.0,2026-01-23,released,
141254943293,1,23-01-2026,23-01-2026,payment,ml_api_or_cache,True,sale,approved,accredited,regular_payment,2000014701953900,134.9,16.19,15.96,102.75,102.75,102.75,0.0,2026-01-23,released,
141256632948,1,21-01-2026,21-01-2026,payment,ml_api_or_cache,True,sale,approved,accredited,regular_payment,2000014635466828,121.9,14.63,15.96,91.31,91.31,91.31,0.0,2026-01-21,released,
141259669610,1,20-01-2026,20-01-2026,payment,ml_api_or_cache,True,sale,approved,accredited,regular_payment,2000014635811578,126.9,15.23,15.96,95.71,95.71,95.71,0.0,2026-01-20,released,
141271852354,1,19-01-2026,19-01-2026,payment,ml_api_or_cache,True,sale,approved,accredited,regular_payment,2000014637483556,329.9,39.59,19.95,270.36,270.36,270.36,0.0,2026-01-19,released,
141299801948,1,21-01-2026,21-01-2026,shipping,ml_api_or_cache,False,marketplace_shipment,approved,accredited,regular_payment,46235424723,0.0,0.0,0.0,0.0,0.0,48.99,0.0,2026-01-21,released,
141299911863,1,14-01-2026,14-01-2026,payment,ml_api_or_cache,False,no_order_id,approved,accredited,regular_payment,,0.0,0.0,0.0,0.0,0.0,-632.79,0.0,2026-01-14,released,
141300246121,1,26-01-2026,26-01-2026,payment,ml_api_or_cache,True,sale,approved,accredited,regular_payment,2000014706915946,289.0,34.68,23.45,230.87,230.87,230.87,0.0,2026-01-26,released,
141305256844,1,15-01-2026,15-01-2026,payment,ml_api_or_cache,True,sale,approved,accredited,payment_addition,2000014610266988,29.9,1.34,0.0,28.56,28.56,28.56,0.0,2026-01-15,released,
141312103933,1,24-01-2026,24-01-2026,payment,ml_api_or_cache,True,sale,approved,accredited,regular_payment,2000014707982566,120.9,14.51,15.96,90.43,90.43,90.43,0.0,2026-01-24,released,
141320649825,1,26-01-2026,26-01-2026,payment,ml_api_or_cache,True,sale,approved,accredited,regular_payment,2000014708952218,622.9,74.75,28.45,519.7,519.7,519.7,0.0,2026-01-26,released,
141324429786,1,22-01-2026,22-01-2026,payment,ml_api_or_cache,True,sale,approved,accredited,regular_payment,2000014641881788,570.26,59.61,24.95,485.7,485.7,485.7,0.0,2026-01-22,released,
141340491641,1,26-01-2026,26-01-2026,payment,ml_api_or_cache,True,sale,approved,accredited,regular_payment,2000014711102244,866.9,104.03,23.45,739.42,739.42,739.42,0.0,2026-01-26,released,
141346643973,1,24-01-2026,24-01-2026,payment,ml_api_or_cache,True,sale,approved,accredited,regular_payment,2000014711872054,157.9,18.95,19.3,119.65,119.65,119.65,0.0,2026-01-24,released,
141354683295,1,23-01-2026,23-01-2026,payment,ml_api_or_cache,True,sale,approved,accredited,regular_payment,2000014712988588,134.9,16.19,15.96,102.75,102.75,102.75,0.0,2026-01-23,released,
141355673172,1,09-01-2026,09-01-2026,cashback,ml_api_or_cache,False,no_order_id,approved,accredited,money_transfer,,0.0,0.0,0.0,0.0,0.0,359.91,0.0,2026-01-09,released,
141359034751,1,26-01-2026,26-01-2026,payment,ml_api_or_cache,True,sale,approved,accredited,regular_payment,2000014713572816,51.9,12.98,0.0,38.92,38.92,38.92,0.0,2026-01-26,released,
141372957403,1,26-01-2026,26-01-2026,payment,ml_api_or_cache,True,sale,approved,accredited,regular_payment,2000014715347852,517.9,62.15,26.95,428.8,428.8,428.8,0.0,2026-01-26,released,
141385949804,1,26-01-2026,26-01-2026,payment,ml_api_or_cache,True,sale,refunded,bpp_refunded,regular_payment,2000014647436364,491.9,59.03,26.95,405.92,405.92,405.92,0.0,2026-01-26,released,
141400370059,1,14-01-2026,14-01-2026,payment,unresolved,False,unresolved_not_found_in_ml,,,,,0.0,0.0,0.0,0.0,0.0,-20.36,0.0,,,"Client error '404 Not Found' for url 'https://api.mercadopago.com/v1/payments/141400370059'
For more information check: https://developer.mozilla.org/en-US/docs/Web/HTTP/Status/404"
141403395103,1,26-01-2026,26-01-2026,payment,ml_api_or_cache,True,sale,approved,accredited,regular_payment,2000014718505070,19.9,8.64,0.0,11.26,11.26,11.26,0.0,2026-01-26,released,
141403860332,1,23-01-2026,23-01-2026,payment,ml_api_or_cache,True,sale,approved,accredited,regular_payment,2000014648866996,135.9,16.31,17.16,102.43,102.43,102.43,0.0,2026-01-23,released,
141427378366,1,25-01-2026,25-01-2026,payment,ml_api_or_cache,True,sale,in_mediation,pending,regular_payment,2000014651224918,769.8,92.38,42.9,634.52,634.52,634.52,0.0,2026-01-25,released,
141442505475,1,26-01-2026,26-01-2026,payment,ml_api_or_cache,True,sale,approved,accredited,regular_payment,2000014722327954,1227.9,147.35,28.45,1052.1,1052.1,1052.1,0.0,2026-01-26,released,
141443091689,1,25-01-2026,25-01-2026,payment,ml_api_or_cache,True,sale,approved,accredited,regular_payment,2000014722386120,126.9,15.23,15.96,95.71,95.71,95.71,0.0,2026-01-25,released,
141448841633,1,15-01-2026,15-01-2026,payout,unresolved,False,unresolved_not_found_in_ml,,,,,0.0,0.0,0.0,0.0,0.0,-50.0,0.0,,,"Client error '404 Not Found' for url 'https://api.mercadopago.com/v1/payments/141448841633'
For more information check: https://developer.mozilla.org/en-US/docs/Web/HTTP/Status/404"
141451914771,3,15-01-2026,15-01-2026,mediation | payment | refund,ml_api_or_cache,True,sale,refunded,bpp_refunded,regular_payment,2000014723192990,21.89,9.97,0.0,11.92,11.92,0.0,-11.92,2026-01-15,released,
141455394940,1,23-01-2026,23-01-2026,payment,ml_api_or_cache,True,sale,approved,accredited,regular_payment,2000014653946644,1588.9,190.67,24.95,1373.28,1373.28,1373.28,0.0,2026-01-23,released,
141457429491,1,15-01-2026,15-01-2026,payment,ml_api_or_cache,True,sale,approved,accredited,regular_payment,37322414560,59.9,2.98,0.0,56.92,56.92,56.92,0.0,2026-01-15,released,
141461535001,1,26-01-2026,26-01-2026,payment,ml_api_or_cache,True,sale,approved,accredited,regular_payment,2000014724258634,551.9,93.82,26.95,431.13,431.13,431.13,0.0,2026-01-26,released,
141468345590,1,21-01-2026,21-01-2026,payment,ml_api_or_cache,True,sale,approved,accredited,regular_payment,2000014655013178,275.9,33.11,23.45,219.34,219.34,219.34,0.0,2026-01-21,released,
141470360279,1,26-01-2026,26-01-2026,payment,ml_api_or_cache,True,sale,approved,accredited,regular_payment,2000014725167890,134.9,16.19,15.96,102.75,102.75,102.75,0.0,2026-01-26,released,
141482320868,1,22-01-2026,22-01-2026,payment,ml_api_or_cache,True,sale,approved,accredited,regular_payment,2000014656231482,78.9,16.22,0.0,62.68,62.68,62.68,0.0,2026-01-22,released,
141503111058,1,22-01-2026,22-01-2026,payment,ml_api_or_cache,True,sale,approved,accredited,regular_payment,2000014658321102,251.98,42.84,33.44,175.7,175.7,175.7,0.0,2026-01-22,released,
141505694751,1,26-01-2026,26-01-2026,payment,ml_api_or_cache,True,sale,approved,accredited,regular_payment,2000014729366094,573.9,97.56,24.95,451.39,451.39,451.39,0.0,2026-01-26,released,
141508375497,6,27-01-2026,30-01-2026,mediation | payment | refund | reserve_for_dispute,ml_api_or_cache,True,sale,refunded,bpp_refunded,regular_payment,2000014729673458,122.9,14.75,18.76,89.39,89.39,-65.66,-155.05,2026-01-27,released,
141521947657,1,26-01-2026,26-01-2026,payment,ml_api_or_cache,True,sale,approved,accredited,regular_payment,2000014731061350,1295.9,155.51,44.45,1095.94,1095.94,1095.94,0.0,2026-01-26,released,
141527595509,4,29-01-2026,29-01-2026,mediation | payment | refund,ml_api_or_cache,True,sale,refunded,bpp_refunded,regular_payment,2000014731591246,273.9,46.56,23.45,203.89,203.89,-70.35,-274.24,2026-01-29,released,
141555524687,3,15-01-2026,15-01-2026,mediation | payment | refund,ml_api_or_cache,True,sale,refunded,bpp_refunded,regular_payment,2000014734509420,144.9,17.39,15.96,111.55,111.55,0.0,-111.55,2026-01-15,released,
141587118535,1,26-01-2026,26-01-2026,payment,ml_api_or_cache,True,sale,approved,accredited,regular_payment,2000014737240654,86.99,10.44,12.87,63.68,63.68,63.68,0.0,2026-01-26,released,
141596403673,1,26-01-2026,26-01-2026,shipping,ml_api_or_cache,False,marketplace_shipment,approved,accredited,regular_payment,46281104088,0.0,0.0,0.0,0.0,0.0,18.99,0.0,2026-01-26,released,
141601973073,1,26-01-2026,26-01-2026,payment,ml_api_or_cache,True,sale,approved,accredited,regular_payment,2000014738521972,299.9,35.99,23.45,240.46,240.46,240.46,0.0,2026-01-26,released,
141606778057,1,26-01-2026,26-01-2026,payment,ml_api_or_cache,True,sale,approved,accredited,regular_payment,2000014739000186,54.9,13.06,0.0,41.84,41.84,41.84,0.0,2026-01-26,released,
141609371619,4,17-01-2026,17-01-2026,mediation | payment | refund,ml_api_or_cache,True,sale,refunded,bpp_refunded,regular_payment,2000014739234852,23.9,9.12,0.0,14.78,14.78,0.0,-14.78,2026-01-17,released,
141612518054,1,26-01-2026,26-01-2026,payment,ml_api_or_cache,True,sale,approved,accredited,regular_payment,2000014668610626,419.9,50.39,24.95,344.56,344.56,344.56,0.0,2026-01-26,released,
141612723343,5,25-01-2026,27-01-2026,mediation | payment | refund | reserve_for_dispute,ml_api_or_cache,True,sale,approved,partially_bpp_refunded,regular_payment,2000014739557560,241.8,29.02,31.92,180.86,180.86,91.92,-88.94,2026-01-25,released,
141623517505,1,16-01-2026,16-01-2026,payout,unresolved,False,unresolved_not_found_in_ml,,,,,0.0,0.0,0.0,0.0,0.0,-941.16,0.0,,,"Client error '404 Not Found' for url 'https://api.mercadopago.com/v1/payments/141623517505'
For more information check: https://developer.mozilla.org/en-US/docs/Web/HTTP/Status/404"
141637047724,1,26-01-2026,26-01-2026,payment,ml_api_or_cache,True,sale,approved,accredited,regular_payment,2000014671749074,71.9,15.38,0.0,56.52,56.52,56.52,0.0,2026-01-26,released,
141638563857,1,16-01-2026,16-01-2026,payout,unresolved,False,unresolved_not_found_in_ml,,,,,0.0,0.0,0.0,0.0,0.0,-6874.64,0.0,,,"Client error '404 Not Found' for url 'https://api.mercadopago.com/v1/payments/141638563857'
For more information check: https://developer.mozilla.org/en-US/docs/Web/HTTP/Status/404"
141638681313,1,26-01-2026,26-01-2026,payment,ml_api_or_cache,True,sale,approved,accredited,regular_payment,2000014742175450,149.8,31.48,0.0,118.32,118.32,118.32,0.0,2026-01-26,released,
141649782618,1,26-01-2026,26-01-2026,payment,ml_api_or_cache,True,sale,approved,accredited,regular_payment,2000014673217244,942.9,113.15,44.45,785.3,785.3,785.3,0.0,2026-01-26,released,
141651144448,1,22-01-2026,22-01-2026,payment,ml_api_or_cache,True,sale,approved,accredited,regular_payment,2000014673384666,99.9,11.99,12.87,75.04,75.04,75.04,0.0,2026-01-22,released,
141668255011,1,26-01-2026,26-01-2026,payment,ml_api_or_cache,True,sale,approved,accredited,regular_payment,2000014745097698,319.0,38.28,23.45,257.27,257.27,257.27,0.0,2026-01-26,released,
141686861422,1,26-01-2026,26-01-2026,payment,ml_api_or_cache,True,sale,approved,accredited,regular_payment,2000014676303162,570.9,97.05,24.95,448.9,448.9,448.9,0.0,2026-01-26,released,
141690581846,1,21-01-2026,21-01-2026,payment,ml_api_or_cache,True,sale,approved,accredited,regular_payment,2000014676673534,149.1,25.35,15.96,107.79,107.79,107.79,0.0,2026-01-21,released,
141692624355,1,26-01-2026,26-01-2026,payment,ml_api_or_cache,True,sale,approved,accredited,regular_payment,2000014746961740,289.0,34.68,23.45,230.87,230.87,230.87,0.0,2026-01-26,released,
141693604662,3,23-01-2026,26-01-2026,mediation | payment | reserve_for_dispute,ml_api_or_cache,True,sale,refunded,bpp_refunded,regular_payment,2000014676992144,109.9,18.68,13.96,77.26,77.26,-39.9,-117.16,2026-01-23,released,
141703327630,1,22-01-2026,22-01-2026,payment,ml_api_or_cache,True,sale,approved,accredited,regular_payment,2000014678021028,339.9,57.78,23.45,258.67,258.67,258.67,0.0,2026-01-22,released,
141703950922,5,16-01-2026,16-01-2026,mediation | payment | refund | reserve_for_bpp_shipping_return,ml_api_or_cache,True,sale,refunded,bpp_refunded,regular_payment,2000014678106620,259.0,31.08,24.95,202.97,202.97,0.0,-202.97,2026-01-16,released,
141714481520,1,25-01-2026,25-01-2026,payment,ml_api_or_cache,True,sale,approved,accredited,regular_payment,2000014679149462,1456.96,140.87,44.45,1271.64,1271.64,1271.64,0.0,2026-01-25,released,
141730979138,1,23-01-2026,23-01-2026,payment,ml_api_or_cache,True,sale,approved,accredited,regular_payment,2000014681002300,317.9,54.04,24.95,238.91,238.91,238.91,0.0,2026-01-23,released,
141741288274,1,12-01-2026,12-01-2026,payment,ml_api_or_cache,False,no_order_id,approved,accredited,regular_payment,,0.0,0.0,0.0,0.0,0.0,-865.11,0.0,2026-01-12,released,
141741680000,1,22-01-2026,22-01-2026,payment,ml_api_or_cache,True,sale,approved,accredited,regular_payment,2000014682469576,780.5,75.46,24.95,680.09,680.09,680.09,0.0,2026-01-22,released,
141747614296,1,24-01-2026,24-01-2026,payment,ml_api_or_cache,True,sale,refunded,bpp_refunded,regular_payment,2000014683231664,847.9,101.75,26.95,719.2,719.2,719.2,0.0,2026-01-24,released,
141754233700,1,24-01-2026,24-01-2026,payment,ml_api_or_cache,True,sale,approved,accredited,regular_payment,2000014684029600,68.9,18.46,0.0,50.44,50.44,50.44,0.0,2026-01-24,released,
141811987559,1,26-01-2026,26-01-2026,payment,ml_api_or_cache,True,sale,approved,accredited,regular_payment,2000014757865838,491.9,59.03,24.95,407.92,407.92,407.92,0.0,2026-01-26,released,
141836496376,1,13-01-2026,13-01-2026,payment,ml_api_or_cache,False,no_order_id,approved,accredited,regular_payment,,0.0,0.0,0.0,0.0,0.0,-1435.56,0.0,2026-01-13,released,
141864443428,1,23-01-2026,23-01-2026,payment,ml_api_or_cache,True,sale,approved,accredited,regular_payment,2000014695635490,74.9,15.74,0.0,59.16,59.16,59.16,0.0,2026-01-23,released,
141868345222,1,25-01-2026,25-01-2026,payment,ml_api_or_cache,True,sale,approved,accredited,regular_payment,2000014696113766,121.9,14.63,15.96,91.31,91.31,91.31,0.0,2026-01-25,released,
141868351474,1,25-01-2026,25-01-2026,payment,ml_api_or_cache,True,sale,approved,accredited,regular_payment,2000014696140016,54.9,13.06,0.0,41.84,41.84,41.84,0.0,2026-01-25,released,
141877674196,1,24-01-2026,24-01-2026,payment,ml_api_or_cache,True,sale,approved,accredited,regular_payment,2000014697220560,508.9,61.07,44.45,403.38,403.38,403.38,0.0,2026-01-24,released,
141920146209,1,26-01-2026,26-01-2026,payment,ml_api_or_cache,True,sale,approved,accredited,regular_payment,2000014769294410,126.9,15.23,17.96,93.71,93.71,93.71,0.0,2026-01-26,released,
141922182246,1,26-01-2026,26-01-2026,payment,ml_api_or_cache,True,sale,approved,accredited,regular_payment,2000014702447426,29.9,9.94,0.0,19.96,19.96,19.96,0.0,2026-01-26,released,
141928120948,1,26-01-2026,26-01-2026,payment,ml_api_or_cache,True,sale,approved,accredited,regular_payment,2000014703109514,474.9,80.73,23.45,370.72,370.72,370.72,0.0,2026-01-26,released,
141937841529,1,26-01-2026,26-01-2026,payment,ml_api_or_cache,True,sale,approved,accredited,regular_payment,2000014771706462,99.9,11.99,11.97,75.94,75.94,75.94,0.0,2026-01-26,released,
141963223933,1,19-01-2026,19-01-2026,payment,ml_api_or_cache,False,collector_set_1305559251,approved,accredited,regular_payment,37434446182,0.0,0.0,0.0,0.0,0.0,-3010.62,0.0,2026-01-19,released,
141963473267,1,19-01-2026,19-01-2026,payment,ml_api_or_cache,False,no_order_id,approved,accredited,regular_payment,,0.0,0.0,0.0,0.0,0.0,-1419.17,0.0,2026-01-19,released,
141963576589,1,19-01-2026,19-01-2026,payment,ml_api_or_cache,False,no_order_id,approved,accredited,regular_payment,,0.0,0.0,0.0,0.0,0.0,-624.55,0.0,2026-01-19,released,
141969774935,1,26-01-2026,26-01-2026,payment,ml_api_or_cache,True,sale,approved,accredited,regular_payment,2000014774046630,152.19,15.91,21.1,115.18,115.18,115.18,0.0,2026-01-26,released,
141972916411,1,26-01-2026,26-01-2026,payment,ml_api_or_cache,True,sale,approved,accredited,regular_payment,2000014774319680,72.9,15.5,0.0,57.4,57.4,57.4,0.0,2026-01-26,released,
141977294293,1,26-01-2026,26-01-2026,payment,ml_api_or_cache,True,sale,approved,accredited,regular_payment,2000014774813462,269.0,32.28,23.45,213.27,213.27,213.27,0.0,2026-01-26,released,
141979194794,2,25-01-2026,26-01-2026,payment | reserve_for_dispute,ml_api_or_cache,True,sale,refunded,bpp_refunded,regular_payment,2000014708445634,132.9,15.95,19.96,96.99,96.99,0.0,-96.99,2026-01-25,released,
141981435068,1,25-01-2026,25-01-2026,payment,ml_api_or_cache,True,sale,approved,accredited,regular_payment,2000014708674974,4901.9,588.23,44.45,4269.22,4269.22,4269.22,0.0,2026-01-25,released,
141986842217,1,26-01-2026,26-01-2026,payment,ml_api_or_cache,True,sale,approved,accredited,regular_payment,2000014775836718,273.9,46.56,23.45,203.89,203.89,203.89,0.0,2026-01-26,released,
141990834572,1,25-01-2026,25-01-2026,payment,ml_api_or_cache,True,sale,approved,accredited,regular_payment,2000014709731326,25.9,9.36,0.0,16.54,16.54,16.54,0.0,2026-01-25,released,
141996119325,1,26-01-2026,26-01-2026,payment,ml_api_or_cache,True,sale,approved,accredited,regular_payment,2000014776746998,494.89,84.13,26.95,383.81,383.81,383.81,0.0,2026-01-26,released,
142005753069,5,26-01-2026,27-01-2026,mediation | payment | refund | reserve_for_bpp_shipping_return,ml_api_or_cache,True,sale,refunded,bpp_refunded,regular_payment,2000014777915284,37.9,11.05,0.0,26.85,26.85,0.0,-26.85,2026-01-26,released,
142011138281,1,26-01-2026,26-01-2026,payment,ml_api_or_cache,True,sale,approved,accredited,regular_payment,2000014778681898,99.0,16.83,11.97,70.2,70.2,70.2,0.0,2026-01-26,released,
142019507831,1,26-01-2026,26-01-2026,payment,ml_api_or_cache,True,sale,approved,accredited,regular_payment,2000014779887736,134.9,16.19,17.16,101.55,101.55,101.55,0.0,2026-01-26,released,
142019554696,1,24-01-2026,24-01-2026,payment,ml_api_or_cache,True,sale,approved,accredited,regular_payment,2000014713202352,437.4,93.0,0.0,344.4,344.4,344.4,0.0,2026-01-24,released,
142022866968,1,26-01-2026,26-01-2026,payment,ml_api_or_cache,True,sale,approved,accredited,regular_payment,2000014713635552,118.9,20.21,15.01,83.68,83.68,83.68,0.0,2026-01-26,released,
142028415124,1,26-01-2026,26-01-2026,payment,ml_api_or_cache,True,sale,approved,accredited,regular_payment,2000014714419290,491.9,59.03,26.95,405.92,405.92,405.92,0.0,2026-01-26,released,
142030628589,1,26-01-2026,26-01-2026,payment,ml_api_or_cache,True,sale,approved,accredited,regular_payment,2000014781281154,134.9,16.19,17.16,101.55,101.55,101.55,0.0,2026-01-26,released,
142034111300,1,25-01-2026,25-01-2026,payment,ml_api_or_cache,True,sale,approved,accredited,regular_payment,2000014715069146,275.9,33.11,23.45,219.34,219.34,219.34,0.0,2026-01-25,released,
142034244195,1,26-01-2026,26-01-2026,payment,ml_api_or_cache,True,sale,approved,accredited,regular_payment,2000014781684178,118.9,20.21,15.01,83.68,83.68,83.68,0.0,2026-01-26,released,
142037096303,1,26-01-2026,26-01-2026,payment,ml_api_or_cache,True,sale,approved,accredited,regular_payment,2000014781983104,259.0,31.08,23.45,204.47,204.47,204.47,0.0,2026-01-26,released,
142038148246,4,22-01-2026,24-01-2026,mediation | payment | refund,ml_api_or_cache,True,sale,refunded,bpp_refunded,regular_payment,2000014715460022,136.9,16.43,17.16,103.31,103.31,-60.06,-163.37,2026-01-22,released,
142046848116,5,24-01-2026,27-01-2026,mediation | payment | refund | reserve_for_dispute,ml_api_or_cache,True,sale,refunded,bpp_refunded,regular_payment,2000014716335582,157.9,18.95,19.3,119.65,119.65,0.0,-119.65,2026-01-24,released,
142052290099,1,26-01-2026,26-01-2026,shipping,ml_api_or_cache,False,marketplace_shipment,approved,accredited,regular_payment,46301755224,0.0,0.0,0.0,0.0,0.0,30.99,0.0,2026-01-26,released,
142076087281,1,26-01-2026,26-01-2026,payment,ml_api_or_cache,True,sale,approved,accredited,regular_payment,2000014787096520,134.9,16.19,17.16,101.55,101.55,101.55,0.0,2026-01-26,released,
142092143296,1,24-01-2026,24-01-2026,payment,ml_api_or_cache,True,sale,approved,accredited,regular_payment,2000014721669060,99.9,11.99,11.97,75.94,75.94,75.94,0.0,2026-01-24,released,
142100582011,2,30-01-2026,30-01-2026,payment | reserve_for_dispute,ml_api_or_cache,True,sale,refunded,bpp_refunded,regular_payment,2000014788667148,490.0,58.8,23.45,407.75,407.75,0.0,-407.75,2026-01-30,released,
142110483725,1,26-01-2026,26-01-2026,payment,ml_api_or_cache,True,sale,approved,accredited,regular_payment,2000014789707612,273.9,46.56,23.45,203.89,203.89,203.89,0.0,2026-01-26,released,
142111464533,1,26-01-2026,26-01-2026,payment,ml_api_or_cache,True,sale,approved,accredited,regular_payment,2000014789806160,296.9,35.63,19.95,241.32,241.32,241.32,0.0,2026-01-26,released,
142113250388,1,26-01-2026,26-01-2026,payment,ml_api_or_cache,True,sale,approved,accredited,regular_payment,2000014722846428,156.9,18.83,20.2,117.87,117.87,117.87,0.0,2026-01-26,released,
142117947517,1,20-01-2026,20-01-2026,payout,unresolved,False,unresolved_not_found_in_ml,,,,,0.0,0.0,0.0,0.0,0.0,-9408.5,0.0,,,"Client error '404 Not Found' for url 'https://api.mercadopago.com/v1/payments/142117947517'
For more information check: https://developer.mozilla.org/en-US/docs/Web/HTTP/Status/404"
142118838162,1,15-01-2026,15-01-2026,payout,unresolved,False,unresolved_not_found_in_ml,,,,,0.0,0.0,0.0,0.0,0.0,-220.93,0.0,,,"Client error '404 Not Found' for url 'https://api.mercadopago.com/v1/payments/142118838162'
For more information check: https://developer.mozilla.org/en-US/docs/Web/HTTP/Status/404"
142120266789,1,26-01-2026,26-01-2026,payment,ml_api_or_cache,True,sale,approved,accredited,regular_payment,2000014790749302,423.9,50.87,26.95,346.08,346.08,346.08,0.0,2026-01-26,released,
142123236115,1,20-01-2026,20-01-2026,cashback,ml_api_or_cache,False,no_order_id,approved,accredited,money_transfer,,0.0,0.0,0.0,0.0,0.0,149.41,0.0,2026-01-20,released,
142130277301,1,26-01-2026,26-01-2026,payment,ml_api_or_cache,True,sale,approved,accredited,regular_payment,2000014791702998,78.87,16.21,0.0,62.66,62.66,62.66,0.0,2026-01-26,released,
142131232550,1,25-01-2026,25-01-2026,payment,ml_api_or_cache,True,sale,approved,accredited,regular_payment,2000014724757350,275.9,33.11,23.45,219.34,219.34,219.34,0.0,2026-01-25,released,
142131998301,1,26-01-2026,26-01-2026,payment,ml_api_or_cache,True,sale,approved,accredited,regular_payment,2000014791912042,104.9,17.83,13.96,73.11,73.11,73.11,0.0,2026-01-26,released,
142135008912,1,26-01-2026,26-01-2026,payment,ml_api_or_cache,True,sale,approved,accredited,regular_payment,2000014725101930,63.9,14.42,0.0,49.48,49.48,49.48,0.0,2026-01-26,released,
142136563453,1,26-01-2026,26-01-2026,payment,ml_api_or_cache,True,sale,approved,accredited,regular_payment,2000014792445534,99.9,11.99,11.97,75.94,75.94,75.94,0.0,2026-01-26,released,
142147169403,1,26-01-2026,26-01-2026,payment,ml_api_or_cache,True,sale,approved,accredited,regular_payment,2000014793803034,149.1,25.35,15.96,107.79,107.79,107.79,0.0,2026-01-26,released,
142154673241,1,26-01-2026,26-01-2026,payment,ml_api_or_cache,True,sale,approved,accredited,regular_payment,2000014794840378,648.9,110.31,26.95,511.64,511.64,511.64,0.0,2026-01-26,released,
142158732075,1,20-01-2026,20-01-2026,payout,unresolved,False,unresolved_not_found_in_ml,,,,,0.0,0.0,0.0,0.0,0.0,-936.34,0.0,,,"Client error '404 Not Found' for url 'https://api.mercadopago.com/v1/payments/142158732075'
For more information check: https://developer.mozilla.org/en-US/docs/Web/HTTP/Status/404"
142159912761,1,20-01-2026,20-01-2026,payout,unresolved,False,unresolved_not_found_in_ml,,,,,0.0,0.0,0.0,0.0,0.0,-936.34,0.0,,,"Client error '404 Not Found' for url 'https://api.mercadopago.com/v1/payments/142159912761'
For more information check: https://developer.mozilla.org/en-US/docs/Web/HTTP/Status/404"
142160416821,1,20-01-2026,20-01-2026,payment,ml_api_or_cache,False,no_order_id,approved,accredited,regular_payment,,0.0,0.0,0.0,0.0,0.0,936.34,0.0,2026-01-20,released,
142160561867,1,26-01-2026,26-01-2026,payment,ml_api_or_cache,True,sale,approved,accredited,regular_payment,2000014795575142,1908.9,229.07,65.95,1613.88,1613.88,1613.88,0.0,2026-01-26,released,
142161123650,1,26-01-2026,26-01-2026,payment,ml_api_or_cache,True,sale,approved,accredited,regular_payment,2000014728076768,58.9,13.82,0.0,45.08,45.08,45.08,0.0,2026-01-26,released,
142167133270,1,26-01-2026,26-01-2026,payment,ml_api_or_cache,True,sale,approved,accredited,regular_payment,2000014728853756,427.9,51.35,26.95,349.6,349.6,349.6,0.0,2026-01-26,released,
142172023524,1,26-01-2026,26-01-2026,payment,ml_api_or_cache,True,sale,approved,accredited,regular_payment,2000014729500248,132.9,22.59,17.16,93.15,93.15,93.15,0.0,2026-01-26,released,
142172057675,1,26-01-2026,26-01-2026,payment,ml_api_or_cache,True,sale,approved,accredited,regular_payment,2000014796834102,269.0,32.28,23.45,213.27,213.27,213.27,0.0,2026-01-26,released,
142173405095,1,26-01-2026,26-01-2026,payment,ml_api_or_cache,True,sale,approved,accredited,regular_payment,2000014796911898,21.89,9.97,0.0,11.92,11.92,11.92,0.0,2026-01-26,released,
142173696624,1,26-01-2026,26-01-2026,payment,ml_api_or_cache,True,sale,approved,accredited,regular_payment,2000014729653468,410.9,69.85,23.45,317.6,317.6,317.6,0.0,2026-01-26,released,
142176183494,1,26-01-2026,26-01-2026,payment,ml_api_or_cache,True,sale,approved,accredited,regular_payment,2000014729998692,137.9,23.44,37.95,76.51,76.51,76.51,0.0,2026-01-26,released,
142176328322,1,26-01-2026,26-01-2026,shipping,ml_api_or_cache,False,marketplace_shipment,approved,accredited,regular_payment,46277167613,0.0,0.0,0.0,0.0,0.0,19.99,0.0,2026-01-26,released,
142181590693,1,26-01-2026,26-01-2026,payment,ml_api_or_cache,True,sale,refunded,bpp_refunded,regular_payment,2000014797762770,289.0,34.68,23.45,230.87,230.87,230.87,0.0,2026-01-26,released,
142205197781,1,26-01-2026,26-01-2026,payment,ml_api_or_cache,True,sale,approved,accredited,regular_payment,2000014800462332,86.99,10.44,12.87,63.68,63.68,63.68,0.0,2026-01-26,released,
142213392666,1,26-01-2026,26-01-2026,payment,ml_api_or_cache,True,sale,approved,accredited,regular_payment,2000014733610354,289.0,34.68,23.45,230.87,230.87,230.87,0.0,2026-01-26,released,
142225887116,3,22-01-2026,22-01-2026,mediation | payment | refund,ml_api_or_cache,True,sale,refunded,bpp_refunded,regular_payment,2000014735134798,583.9,70.07,23.45,490.38,490.38,0.0,-490.38,2026-01-22,released,
142245565365,1,26-01-2026,26-01-2026,payment,ml_api_or_cache,True,sale,approved,accredited,regular_payment,2000014804305260,273.9,46.56,23.45,203.89,203.89,203.89,0.0,2026-01-26,released,
142253253608,1,26-01-2026,26-01-2026,payment,ml_api_or_cache,True,sale,approved,accredited,regular_payment,2000014737249548,1270.69,132.83,44.45,1093.41,1093.41,1093.41,0.0,2026-01-26,released,
142257561686,1,26-01-2026,26-01-2026,payment,ml_api_or_cache,True,sale,approved,accredited,regular_payment,2000014737564096,146.9,24.97,17.16,104.77,104.77,104.77,0.0,2026-01-26,released,
142260272966,1,26-01-2026,26-01-2026,payment,ml_api_or_cache,True,sale,approved,accredited,regular_payment,2000014737802526,531.46,55.56,44.45,431.45,431.45,431.45,0.0,2026-01-26,released,
142262580120,1,26-01-2026,26-01-2026,payment,ml_api_or_cache,True,sale,approved,accredited,regular_payment,2000014737998746,202.54,21.0,51.82,129.72,129.72,129.72,0.0,2026-01-26,released,
142263952094,1,26-01-2026,26-01-2026,payment,ml_api_or_cache,True,sale,approved,accredited,regular_payment,2000014738150314,120.9,14.51,17.16,89.23,89.23,89.23,0.0,2026-01-26,released,
142275241347,1,26-01-2026,26-01-2026,payment,ml_api_or_cache,True,sale,approved,accredited,regular_payment,2000014807548150,99.9,11.99,11.97,75.94,75.94,75.94,0.0,2026-01-26,released,
142280993584,1,25-01-2026,25-01-2026,payment,ml_api_or_cache,True,sale,approved,accredited,regular_payment,2000014739737718,134.9,16.19,17.16,101.55,101.55,101.55,0.0,2026-01-25,released,
142282774610,1,26-01-2026,26-01-2026,payment,ml_api_or_cache,True,sale,approved,accredited,regular_payment,2000014739890766,71.9,15.38,0.0,56.52,56.52,56.52,0.0,2026-01-26,released,
142292552528,1,26-01-2026,26-01-2026,payment,ml_api_or_cache,True,sale,approved,accredited,regular_payment,2000014740782428,117.9,14.15,15.01,88.74,88.74,88.74,0.0,2026-01-26,released,
142295285552,1,26-01-2026,26-01-2026,payment,ml_api_or_cache,True,sale,approved,accredited,regular_payment,2000014741045310,642.9,109.29,23.45,510.16,510.16,510.16,0.0,2026-01-26,released,
142295633711,1,26-01-2026,26-01-2026,payment,ml_api_or_cache,True,sale,approved,accredited,regular_payment,2000014810332474,317.9,54.04,26.95,236.91,236.91,236.91,0.0,2026-01-26,released,
142304307843,3,23-01-2026,23-01-2026,mediation | payment | refund,ml_api_or_cache,True,sale,refunded,bpp_refunded,regular_payment,2000014811359486,797.9,95.75,44.45,657.7,657.7,0.0,-657.7,2026-01-23,released,
142305986432,1,26-01-2026,26-01-2026,payment,ml_api_or_cache,True,sale,approved,accredited,regular_payment,2000014742296820,686.9,82.43,24.95,579.52,579.52,579.52,0.0,2026-01-26,released,
142317931599,1,21-01-2026,21-01-2026,payment,unresolved,False,unresolved_not_found_in_ml,,,,,0.0,0.0,0.0,0.0,0.0,-11.04,0.0,,,"Client error '404 Not Found' for url 'https://api.mercadopago.com/v1/payments/142317931599'
For more information check: https://developer.mozilla.org/en-US/docs/Web/HTTP/Status/404"
142339588114,1,26-01-2026,26-01-2026,payment,ml_api_or_cache,True,sale,approved,accredited,regular_payment,2000014745462934,903.94,94.49,28.45,781.0,781.0,781.0,0.0,2026-01-26,released,
142341866491,1,26-01-2026,26-01-2026,payment,ml_api_or_cache,True,sale,approved,accredited,regular_payment,2000014815379162,2135.33,206.46,44.45,1884.42,1884.42,1884.42,0.0,2026-01-26,released,
142350168888,1,26-01-2026,26-01-2026,payment,ml_api_or_cache,True,sale,approved,accredited,regular_payment,2000014746275980,836.9,100.43,28.45,708.02,708.02,708.02,0.0,2026-01-26,released,
142350829242,1,25-01-2026,25-01-2026,payment,ml_api_or_cache,True,sale,approved,accredited,regular_payment,2000014746352948,299.0,35.88,23.45,239.67,239.67,239.67,0.0,2026-01-25,released,
142380038891,3,22-01-2026,22-01-2026,mediation | payment | refund,ml_api_or_cache,True,sale,refunded,bpp_refunded,regular_payment,2000014818864972,79.9,13.58,14.07,52.25,52.25,-0.0,-52.25,2026-01-22,released,
142389527043,3,27-01-2026,27-01-2026,mediation | payment | refund,ml_api_or_cache,True,sale,refunded,bpp_refunded,regular_payment,2000014819868958,309.0,37.08,23.45,248.47,248.47,0.0,-248.47,2026-01-27,released,
142389970423,1,26-01-2026,26-01-2026,payment,ml_api_or_cache,True,sale,approved,accredited,regular_payment,2000014819909858,119.9,14.39,13.96,91.55,91.55,91.55,0.0,2026-01-26,released,
142401028865,1,26-01-2026,26-01-2026,payment,ml_api_or_cache,True,sale,approved,accredited,regular_payment,2000014821122284,149.9,17.99,15.96,115.95,115.95,115.95,0.0,2026-01-26,released,
142405842346,5,29-01-2026,30-01-2026,mediation | payment | refund | reserve_for_dispute,ml_api_or_cache,True,sale,refunded,bpp_refunded,regular_payment,2000014751409520,130.9,22.25,18.76,89.89,89.89,-0.0,-89.89,2026-01-29,released,
142406081170,1,26-01-2026,26-01-2026,payment,ml_api_or_cache,True,sale,approved,accredited,regular_payment,2000014751450380,99.9,11.99,11.97,75.94,75.94,75.94,0.0,2026-01-26,released,
142421892121,1,26-01-2026,26-01-2026,payment,ml_api_or_cache,True,sale,approved,accredited,regular_payment,2000014823398494,289.0,34.68,24.95,229.37,229.37,229.37,0.0,2026-01-26,released,
142429420055,1,26-01-2026,26-01-2026,payment,ml_api_or_cache,True,sale,approved,accredited,regular_payment,2000014824459392,289.0,34.68,23.45,230.87,230.87,230.87,0.0,2026-01-26,released,
142435973731,1,26-01-2026,26-01-2026,payment,ml_api_or_cache,True,sale,approved,accredited,regular_payment,2000014825298910,627.63,92.07,85.95,449.61,449.61,449.61,0.0,2026-01-26,released,
142440272507,1,26-01-2026,26-01-2026,payment,ml_api_or_cache,True,sale,approved,accredited,regular_payment,2000014825792778,134.9,16.19,17.16,101.55,101.55,101.55,0.0,2026-01-26,released,
142449492700,1,26-01-2026,26-01-2026,payment,ml_api_or_cache,True,sale,approved,accredited,regular_payment,2000014755189538,39.0,13.13,0.0,25.87,25.87,25.87,0.0,2026-01-26,released,
142455167349,1,22-01-2026,22-01-2026,payment,unresolved,False,unresolved_not_found_in_ml,,,,,0.0,0.0,0.0,0.0,0.0,-46.24,0.0,,,"Client error '404 Not Found' for url 'https://api.mercadopago.com/v1/payments/142455167349'
For more information check: https://developer.mozilla.org/en-US/docs/Web/HTTP/Status/404"
142467169052,1,26-01-2026,26-01-2026,payment,ml_api_or_cache,True,sale,approved,accredited,regular_payment,2000014756882602,86.99,10.44,12.87,63.68,63.68,63.68,0.0,2026-01-26,released,
142520240771,1,23-01-2026,23-01-2026,payment,ml_api_or_cache,False,no_order_id,approved,accredited,regular_payment,,0.0,0.0,0.0,0.0,0.0,-4296.19,0.0,2026-01-23,released,
142530127795,1,23-01-2026,23-01-2026,payout,unresolved,False,unresolved_not_found_in_ml,,,,,0.0,0.0,0.0,0.0,0.0,-30.0,0.0,,,"Client error '404 Not Found' for url 'https://api.mercadopago.com/v1/payments/142530127795'
For more information check: https://developer.mozilla.org/en-US/docs/Web/HTTP/Status/404"
142540120620,1,26-01-2026,26-01-2026,payment,ml_api_or_cache,True,sale,approved,accredited,regular_payment,2000014763424906,367.8,62.52,40.41,264.87,264.87,264.87,0.0,2026-01-26,released,
142561959293,1,26-01-2026,26-01-2026,payment,ml_api_or_cache,True,sale,approved,accredited,regular_payment,2000014837565470,86.99,10.44,12.87,63.68,63.68,63.68,0.0,2026-01-26,released,
142577212466,1,26-01-2026,26-01-2026,payment,ml_api_or_cache,True,sale,approved,accredited,regular_payment,2000014767979840,123.9,14.87,17.96,91.07,91.07,91.07,0.0,2026-01-26,released,
142631356098,1,19-01-2026,19-01-2026,payment,ml_api_or_cache,False,no_order_id,approved,accredited,regular_payment,,0.0,0.0,0.0,0.0,0.0,-349.0,0.0,2026-01-19,released,
142631359778,1,19-01-2026,19-01-2026,payment,ml_api_or_cache,False,no_order_id,approved,accredited,regular_payment,,0.0,0.0,0.0,0.0,0.0,-1264.68,0.0,2026-01-19,released,
142631650030,1,19-01-2026,19-01-2026,payment,ml_api_or_cache,False,no_order_id,approved,accredited,regular_payment,,0.0,0.0,0.0,0.0,0.0,-1754.56,0.0,2026-01-19,released,
142644934614,1,26-01-2026,26-01-2026,payment,ml_api_or_cache,True,sale,approved,accredited,regular_payment,2000014774671034,432.9,51.95,23.45,357.5,357.5,357.5,0.0,2026-01-26,released,
142646872378,3,19-01-2026,19-01-2026,mediation | payment | refund,ml_api_or_cache,True,sale,refunded,bpp_refunded,regular_payment,2000014774875338,121.9,14.63,17.16,90.11,90.11,-0.0,-90.11,2026-01-19,released,
142651643835,3,26-01-2026,26-01-2026,mediation | payment | refund,ml_api_or_cache,True,sale,refunded,bpp_refunded,regular_payment,2000014846058504,236.9,28.43,23.45,185.02,185.02,0.0,-185.02,2026-01-26,released,
142651949400,4,22-01-2026,22-01-2026,mediation | payment | refund,ml_api_or_cache,True,sale,refunded,bpp_refunded,regular_payment,2000014775423054,39.99,13.3,0.0,26.69,26.69,-28.4,-55.09,2026-01-22,released,
142656939555,1,26-01-2026,26-01-2026,payment,ml_api_or_cache,True,sale,approved,accredited,regular_payment,2000014846510718,186.97,16.66,20.2,150.11,150.11,150.11,0.0,2026-01-26,released,
142675363698,1,26-01-2026,26-01-2026,payment,ml_api_or_cache,True,sale,approved,accredited,regular_payment,2000014777957834,649.9,77.99,44.45,527.46,527.46,527.46,0.0,2026-01-26,released,
142686034398,1,26-01-2026,26-01-2026,payment,ml_api_or_cache,True,sale,approved,accredited,regular_payment,2000014779546936,289.0,34.68,24.95,229.37,229.37,229.37,0.0,2026-01-26,released,
142698519459,5,26-01-2026,27-01-2026,mediation | payment | refund | reserve_for_dispute,ml_api_or_cache,True,sale,refunded,bpp_covered,regular_payment,2000014850230708,99.0,16.83,11.97,70.2,70.2,0.0,-70.2,2026-01-26,released,
142707973090,1,26-01-2026,26-01-2026,payment,ml_api_or_cache,True,sale,approved,accredited,regular_payment,2000014782153142,253.9,30.47,23.45,199.98,199.98,199.98,0.0,2026-01-26,released,
142721955434,1,26-01-2026,26-01-2026,payment,ml_api_or_cache,True,sale,approved,accredited,regular_payment,2000014783645992,273.9,46.56,54.44,172.9,172.9,172.9,0.0,2026-01-26,released,
142784056486,1,26-01-2026,26-01-2026,payment,ml_api_or_cache,True,sale,approved,accredited,regular_payment,2000014790063320,557.89,53.95,23.45,480.49,480.49,480.49,0.0,2026-01-26,released,
142804447735,1,25-01-2026,25-01-2026,payment,ml_api_or_cache,False,no_order_id,approved,accredited,regular_payment,,0.0,0.0,0.0,0.0,0.0,-818.38,0.0,2026-01-25,released,
142804506011,1,25-01-2026,25-01-2026,payment,ml_api_or_cache,False,no_order_id,approved,accredited,regular_payment,,0.0,0.0,0.0,0.0,0.0,-1832.37,0.0,2026-01-25,released,
142804560955,1,25-01-2026,25-01-2026,payment,ml_api_or_cache,False,no_order_id,approved,accredited,regular_payment,,0.0,0.0,0.0,0.0,0.0,-1191.6,0.0,2026-01-25,released,
142818087018,1,26-01-2026,26-01-2026,payment,ml_api_or_cache,True,sale,approved,accredited,regular_payment,2000014793915464,319.0,38.28,23.45,257.27,257.27,257.27,0.0,2026-01-26,released,
142828469340,1,26-01-2026,26-01-2026,payment,ml_api_or_cache,True,sale,approved,accredited,regular_payment,2000014795281966,591.9,100.62,24.95,466.33,466.33,466.33,0.0,2026-01-26,released,
142841935136,3,26-01-2026,26-01-2026,mediation | payment | refund,ml_api_or_cache,True,sale,refunded,bpp_refunded,regular_payment,2000014796742676,389.0,46.68,23.45,318.87,318.87,0.0,-318.87,2026-01-26,released,
142882588563,1,26-01-2026,26-01-2026,payout,unresolved,False,unresolved_not_found_in_ml,,,,,0.0,0.0,0.0,0.0,0.0,-95.72,0.0,,,"Client error '404 Not Found' for url 'https://api.mercadopago.com/v1/payments/142882588563'
For more information check: https://developer.mozilla.org/en-US/docs/Web/HTTP/Status/404"
142919680782,1,26-01-2026,26-01-2026,payment,ml_api_or_cache,True,sale,approved,accredited,regular_payment,2000014804620832,2627.9,446.74,44.45,2136.71,2136.71,2136.71,0.0,2026-01-26,released,
142925777775,1,26-01-2026,26-01-2026,payment,ml_api_or_cache,True,sale,approved,accredited,regular_payment,2000014873469134,344.75,41.37,23.45,279.93,279.93,279.93,0.0,2026-01-26,released,
142929356799,1,26-01-2026,26-01-2026,payout,unresolved,False,unresolved_not_found_in_ml,,,,,0.0,0.0,0.0,0.0,0.0,-50.0,0.0,,,"Client error '404 Not Found' for url 'https://api.mercadopago.com/v1/payments/142929356799'
For more information check: https://developer.mozilla.org/en-US/docs/Web/HTTP/Status/404"
142934459175,11,26-01-2026,26-01-2026,fee-release_in_advance | reserve_for_debt_payment,unresolved,False,unresolved_not_found_in_ml,,,,,0.0,0.0,0.0,0.0,0.0,-274.58,0.0,,,"Client error '404 Not Found' for url 'https://api.mercadopago.com/v1/payments/142934459175'
For more information check: https://developer.mozilla.org/en-US/docs/Web/HTTP/Status/404"
142952947024,3,21-01-2026,21-01-2026,mediation | payment | refund,ml_api_or_cache,True,sale,refunded,bpp_refunded,regular_payment,2000014808388148,309.0,37.08,23.45,248.47,248.47,0.0,-248.47,2026-01-21,released,
142953356938,1,26-01-2026,26-01-2026,payment,ml_api_or_cache,True,sale,approved,accredited,regular_payment,2000014808434422,86.99,10.44,12.87,63.68,63.68,63.68,0.0,2026-01-26,released,
142959458860,1,26-01-2026,26-01-2026,payment,ml_api_or_cache,True,sale,refunded,bpp_refunded,regular_payment,2000014809273430,2892.9,347.15,28.45,2517.3,2517.3,2517.3,0.0,2026-01-26,released,
142961208182,2,30-01-2026,30-01-2026,payment | reserve_for_bpp_shipping_return,ml_api_or_cache,True,sale,refunded,bpp_refunded,regular_payment,2000014809546500,236.9,28.43,23.45,185.02,185.02,0.0,-185.02,2026-01-30,released,
142962751506,1,26-01-2026,26-01-2026,payment,ml_api_or_cache,True,sale,approved,accredited,regular_payment,2000014809765000,163.01,14.52,17.95,130.54,130.54,130.54,0.0,2026-01-26,released,
142973958104,1,26-01-2026,26-01-2026,payment,ml_api_or_cache,True,sale,approved,accredited,regular_payment,2000014811172776,30.9,10.21,0.0,20.69,20.69,20.69,0.0,2026-01-26,released,
142975565124,1,26-01-2026,26-01-2026,payment,ml_api_or_cache,True,sale,approved,accredited,regular_payment,2000014811369190,255.9,30.71,26.95,198.24,198.24,198.24,0.0,2026-01-26,released,
142977857214,1,26-01-2026,26-01-2026,payment,ml_api_or_cache,True,sale,approved,accredited,regular_payment,2000014811602934,1537.9,261.44,24.95,1251.51,1251.51,1251.51,0.0,2026-01-26,released,
142981855450,1,26-01-2026,26-01-2026,payment,ml_api_or_cache,True,sale,approved,accredited,regular_payment,2000014811996954,273.9,46.56,23.45,203.89,203.89,203.89,0.0,2026-01-26,released,
142986813344,1,26-01-2026,26-01-2026,payment,ml_api_or_cache,True,sale,approved,accredited,regular_payment,2000014812491820,86.99,10.44,12.87,63.68,63.68,63.68,0.0,2026-01-26,released,
143017449550,1,26-01-2026,26-01-2026,payment,ml_api_or_cache,True,sale,approved,accredited,regular_payment,2000014815968842,59.9,16.63,0.0,43.27,43.27,43.27,0.0,2026-01-26,released,
143054278776,1,26-01-2026,26-01-2026,payment,ml_api_or_cache,True,sale,approved,accredited,regular_payment,2000014819129086,86.99,10.44,12.87,63.68,63.68,63.68,0.0,2026-01-26,released,
143061807204,1,26-01-2026,26-01-2026,payment,ml_api_or_cache,True,sale,approved,accredited,regular_payment,2000014819932328,39.0,13.13,0.0,25.87,25.87,25.87,0.0,2026-01-26,released,
143062284399,1,27-01-2026,27-01-2026,payout,unresolved,False,unresolved_not_found_in_ml,,,,,0.0,0.0,0.0,0.0,0.0,-63.9,0.0,,,"Client error '404 Not Found' for url 'https://api.mercadopago.com/v1/payments/143062284399'
For more information check: https://developer.mozilla.org/en-US/docs/Web/HTTP/Status/404"
143062383912,1,26-01-2026,26-01-2026,payment,ml_api_or_cache,True,sale,approved,accredited,regular_payment,2000014819988832,289.0,34.68,23.45,230.87,230.87,230.87,0.0,2026-01-26,released,
143068364002,1,26-01-2026,26-01-2026,payment,ml_api_or_cache,True,sale,approved,accredited,regular_payment,2000014820641394,186.9,22.43,17.95,146.52,146.52,146.52,0.0,2026-01-26,released,
143104571692,2,26-01-2026,29-01-2026,payment | reserve_for_dispute,ml_api_or_cache,True,sale,refunded,bpp_refunded,regular_payment,2000014824862896,273.9,46.56,23.45,203.89,203.89,0.0,-203.89,2026-01-26,released,
143106524546,1,26-01-2026,26-01-2026,payment,ml_api_or_cache,True,sale,approved,accredited,regular_payment,2000014825106656,384.26,35.79,23.45,325.02,325.02,325.02,0.0,2026-01-26,released,
143189222686,1,23-01-2026,23-01-2026,payout,unresolved,False,unresolved_not_found_in_ml,,,,,0.0,0.0,0.0,0.0,0.0,-140.0,0.0,,,"Client error '404 Not Found' for url 'https://api.mercadopago.com/v1/payments/143189222686'
For more information check: https://developer.mozilla.org/en-US/docs/Web/HTTP/Status/404"
143199074090,1,23-01-2026,23-01-2026,payment,ml_api_or_cache,False,no_order_id,approved,accredited,regular_payment,,0.0,0.0,0.0,0.0,0.0,-131.94,0.0,2026-01-25,released,
143315503969,1,29-01-2026,29-01-2026,cashback,ml_api_or_cache,False,no_order_id,approved,accredited,money_transfer,,0.0,0.0,0.0,0.0,0.0,220.63,0.0,2026-01-29,released,
143315621045,1,29-01-2026,29-01-2026,cashback,ml_api_or_cache,False,no_order_id,approved,accredited,money_transfer,,0.0,0.0,0.0,0.0,0.0,626.46,0.0,2026-01-29,released,
143324328284,4,27-01-2026,28-01-2026,mediation | payment | refund | reserve_for_dispute,ml_api_or_cache,True,sale,refunded,bpp_refunded,regular_payment,2000014845973602,690.9,82.91,44.45,563.54,563.54,-8.98,-572.52,2026-01-27,released,
143348627042,1,26-01-2026,26-01-2026,payment,ml_api_or_cache,True,sale,approved,accredited,regular_payment,2000014847959014,273.9,46.56,23.45,203.89,203.89,203.89,0.0,2026-01-26,released,
143405365928,1,26-01-2026,26-01-2026,payment,ml_api_or_cache,True,sale,approved,accredited,regular_payment,2000014853026306,112.33,10.01,13.96,88.36,88.36,88.36,0.0,2026-01-26,released,
143415634883,3,30-01-2026,30-01-2026,mediation | payment | refund,ml_api_or_cache,True,sale,refunded,bpp_refunded,regular_payment,2000014927240390,479.9,57.59,24.95,397.36,397.36,0.0,-397.36,2026-01-30,released,
143421618909,1,30-01-2026,30-01-2026,payment,ml_api_or_cache,False,no_order_id,approved,accredited,regular_payment,,0.0,0.0,0.0,0.0,0.0,2890.96,0.0,2026-01-30,released,
143434587855,5,30-01-2026,30-01-2026,mediation | payment | refund | reserve_for_dispute,ml_api_or_cache,True,sale,refunded,bpp_refunded,regular_payment,2000014929052364,71.15,15.29,0.0,55.86,55.86,0.0,-55.86,2026-01-30,released,
143449668258,1,26-01-2026,26-01-2026,payment,ml_api_or_cache,True,sale,approved,accredited,regular_payment,2000014857101210,299.9,35.99,23.45,240.46,240.46,240.46,0.0,2026-01-26,released,
143483246774,3,25-01-2026,25-01-2026,mediation | payment | refund,ml_api_or_cache,True,sale,refunded,bpp_refunded,regular_payment,2000014860796558,289.0,34.68,23.45,230.87,230.87,0.0,-230.87,2026-01-25,released,
143486655599,1,30-01-2026,30-01-2026,payout,unresolved,False,unresolved_not_found_in_ml,,,,,0.0,0.0,0.0,0.0,0.0,-1445.0,0.0,,,"Client error '404 Not Found' for url 'https://api.mercadopago.com/v1/payments/143486655599'
For more information check: https://developer.mozilla.org/en-US/docs/Web/HTTP/Status/404"
143487774369,1,30-01-2026,30-01-2026,payout,unresolved,False,unresolved_not_found_in_ml,,,,,0.0,0.0,0.0,0.0,0.0,-1000.0,0.0,,,"Client error '404 Not Found' for url 'https://api.mercadopago.com/v1/payments/143487774369'
For more information check: https://developer.mozilla.org/en-US/docs/Web/HTTP/Status/404"
143557707844,1,26-01-2026,26-01-2026,payment,ml_api_or_cache,True,sale,approved,accredited,regular_payment,2000014868379002,219.12,19.52,27.93,171.67,171.67,171.67,0.0,2026-01-26,released,
143581089158,1,26-01-2026,26-01-2026,cashback,ml_api_or_cache,False,no_order_id,approved,accredited,money_transfer,,0.0,0.0,0.0,0.0,0.0,263.85,0.0,2026-01-26,released,
143608784484,1,26-01-2026,26-01-2026,payment,ml_api_or_cache,True,sale,approved,accredited,regular_payment,2000014874588176,94.05,11.29,11.97,70.79,70.79,70.79,0.0,2026-01-26,released,
143624212572,1,26-01-2026,26-01-2026,payment,ml_api_or_cache,False,no_order_id,approved,accredited,money_transfer,,0.0,0.0,0.0,0.0,0.0,53000.0,0.0,2026-01-26,released,
143625220968,1,26-01-2026,26-01-2026,payout,unresolved,False,unresolved_not_found_in_ml,,,,,0.0,0.0,0.0,0.0,0.0,-24000.0,0.0,,,"Client error '404 Not Found' for url 'https://api.mercadopago.com/v1/payments/143625220968'
For more information check: https://developer.mozilla.org/en-US/docs/Web/HTTP/Status/404"
143625557386,1,26-01-2026,26-01-2026,payment,ml_api_or_cache,False,no_order_id,approved,accredited,regular_payment,,0.0,0.0,0.0,0.0,0.0,-93739.19,0.0,2026-01-26,released,
143762867120,2,28-01-2026,28-01-2026,payment | refund,ml_api_or_cache,True,sale,refunded,refunded,regular_payment,2000014892136406,5000.0,850.0,28.45,4121.55,4121.55,0.0,-4121.55,2026-01-28,released,
143815855230,2,28-01-2026,28-01-2026,payment | refund,ml_api_or_cache,True,sale,refunded,refunded,regular_payment,2000014898175098,5000.0,850.0,28.45,4121.55,4121.55,0.0,-4121.55,2026-01-28,released,
143909170600,2,29-01-2026,29-01-2026,payment | refund,ml_api_or_cache,True,sale,refunded,refunded,regular_payment,2000014908592444,45.9,14.3,0.0,31.6,31.6,0.0,-31.6,2026-01-29,released,
143993074150,1,29-01-2026,29-01-2026,cashback,ml_api_or_cache,False,no_order_id,approved,accredited,money_transfer,,0.0,0.0,0.0,0.0,0.0,470.25,0.0,2026-01-29,released,
144043021616,1,29-01-2026,29-01-2026,payout,unresolved,False,unresolved_not_found_in_ml,,,,,0.0,0.0,0.0,0.0,0.0,-300.0,0.0,,,"Client error '404 Not Found' for url 'https://api.mercadopago.com/v1/payments/144043021616'
For more information check: https://developer.mozilla.org/en-US/docs/Web/HTTP/Status/404"
